name,image
Fashion Gorgeous Fitting Fabulous Vegas Golden Knights Leggings,//cdn.shopify.com/s/files/1/1635/1491/products/Vegas_Golden_Knights_LR_0eac99da-ce8e-4b8c-9947-c65319ab08f0_320X320.jpg?v=1548321015
Single Small Line Circle Stylish Fashion Vegas Golden Knights Leggings,//cdn.shopify.com/s/files/1/1635/1491/products/Vegas_Golden_Knights_LR_320X320.jpg?v=1548326714
Fashion Gorgeous Fitting Fabulous Ohio State Buckeyes Leggings,//cdn.shopify.com/s/files/1/1635/1491/products/Ohio_State_Buckeyes_LR_320X320.jpg?v=1548319922
Cosy Seamless Border Wonderful Vegas Golden Knights Leggings,//cdn.shopify.com/s/files/1/1635/1491/products/Vegas_Golden_Knights_320X320.jpg?v=1548315147
Curly Line Charming Daily Fashion Cleveland Browns Leggings,//cdn.shopify.com/s/files/1/1635/1491/products/49b9f81d-6eac-420e-aa09-9bed5be84aed_320X320.jpg?v=1551155969
Fashion Gorgeous Fitting Fabulous Cleveland Browns Leggings,//cdn.shopify.com/s/files/1/1635/1491/products/Cleveland_Browns_LR_cdc35f8b-ee1f-48c7-962a-e648e38e83be_320X320.jpg?v=1548318424
Through Great Logo Spread Body Striped Circle Vegas Golden Knights Leggings,//cdn.shopify.com/s/files/1/1635/1491/products/Vegas_Golden_Knights_copy_320X320.jpg?v=1548383686
Straight Cute Beautiful Attractive Vegas Golden Knights Leggings,//cdn.shopify.com/s/files/1/1635/1491/products/Vegas_Golden_Knights_994ec0fe-25ab-41ac-91f7-8e8596380af8_320X320.jpg?v=1550715980
Great Urban Night Scene Minnesota Wild Leggings,//cdn.shopify.com/s/files/1/1635/1491/products/c7e200fb-4734-4d37-8907-eb2cbfda4254_320X320.jpg?v=1546007825
Fashion Gorgeous Fitting Fabulous San Jose Sharks Leggings,//cdn.shopify.com/s/files/1/1635/1491/products/San_Jose_Sharks_LR_8ee72b72-d1f0-4ae0-b88b-f84c7983433d_320X320.jpg?v=1548320960
Fashion Gorgeous Fitting Fabulous San Francisco 49ers Leggings,//cdn.shopify.com/s/files/1/1635/1491/products/San_Francisco_49ers_LR_bcc67756-ce54-463e-9bb4-7ee3828d0d79_320X320.jpg?v=1548320954
Fashion Gorgeous Fitting Fabulous Nashville Predators Leggings,//cdn.shopify.com/s/files/1/1635/1491/products/Nashville_Predators_LR_56474abe-d447-4559-ad54-5592f90f2996_320X320.jpg?v=1548319880
Single Small Line Circle Stylish Fashion Nashville Predators Leggings,//cdn.shopify.com/s/files/1/1635/1491/products/Nashville_Predators_LR_320X320.jpg?v=1548325342
Single Small Line Circle Stylish Fashion Ohio State Buckeyes Leggings,//cdn.shopify.com/s/files/1/1635/1491/products/Ohio_State_Buckeyes_GST_07ac4fce-0357-43bd-af9f-9aa3bc93a495_320X320.jpg?v=1548325980
Through Great Logo Spread Body Striped Circle Chicago Bears Leggings,//cdn.shopify.com/s/files/1/1635/1491/products/Chicago_Bears_copy_320X320.jpg?v=1548381690
Cosy Seamless Border Wonderful Minnesota Vikings Leggings,//cdn.shopify.com/s/files/1/1635/1491/products/Minnesota_Vikings_320X320.jpg?v=1548313934
Curly Line Charming Daily Fashion San Francisco 49ers Leggings,//cdn.shopify.com/s/files/1/1635/1491/products/ae0f404f-816f-496d-aab4-6cb4e4d13d02_320X320.jpg?v=1551156596
Straight Cute Beautiful Attractive Toronto Maple Leafs Leggings,//cdn.shopify.com/s/files/1/1635/1491/products/Toronto_Maple_Leafs_33865238-7829-4673-ae3d-cd2312a1f719_320X320.jpg?v=1550715971
Straight Cute Beautiful Attractive Columbus Blue Jackets Leggings,//cdn.shopify.com/s/files/1/1635/1491/products/Columbus_Blue_Jackets_5b9425a3-0126-4318-b085-9a7884e904d9_320X320.jpg?v=1550715373
Charming Lovely Little Dots Along Body New Orleans Saints Leggings,//cdn.shopify.com/s/files/1/1635/1491/products/New_Orleans_Saints_17e9f05b-4768-4a72-b5bd-7e1660474d17_320X320.jpg?v=1550629510
Boho Houston Astros Leggings With Fantastic Art,//cdn.shopify.com/s/files/1/1635/1491/products/Houston_Astros_746a65db-a4d7-4b27-ad4c-ec6d83c909e7_320X320.jpg?v=1548389280
Mysterious Smoke Colors Philadelphia Eagles Leggings,//cdn.shopify.com/s/files/1/1635/1491/products/8070460c-5f42-4289-9aff-010b429c4acf_320X320.jpg?v=1543905641
Great Urban Night Scene Cleveland Browns Leggings,//cdn.shopify.com/s/files/1/1635/1491/products/5d927b96-d818-434d-828f-de4d48bb01c2_320X320.jpg?v=1546008058
Great Urban Night Scene Alabama Crimson Tide Leggings,//cdn.shopify.com/s/files/1/1635/1491/products/af4ca8c7-0dde-45f4-bbb0-348df897ddc8_320X320.jpg?v=1546008170
Fashion Gorgeous Fitting Fabulous Columbus Blue Jackets Leggings,//cdn.shopify.com/s/files/1/1635/1491/products/Columbus_Blue_Jackets_LR_113c38ba-8ee1-4ad6-be50-2421677056fc_320X320.jpg?v=1548318441
Single Small Line Circle Stylish Fashion Edmonton Oilers Leggings,//cdn.shopify.com/s/files/1/1635/1491/products/Edmonton_Oilers_LR_320X320.jpg?v=1548324248
Single Small Line Circle Stylish Fashion Columbus Blue Jackets Leggings,//cdn.shopify.com/s/files/1/1635/1491/products/Columbus_Blue_Jackets_LR_320X320.jpg?v=1548323620
Single Small Line Circle Stylish Fashion Houston Astros Leggings,//cdn.shopify.com/s/files/1/1635/1491/products/Houston_Astros_LR_d28eb7a5-e6fe-4e56-80f0-4507aea92809_320X320.jpg?v=1548324674
Fashion Gorgeous Fitting Fabulous Alabama Crimson Tide Leggings,//cdn.shopify.com/s/files/1/1635/1491/products/Alabama_Crimson_Tide_LR_320X320.jpg?v=1548317498
Through Great Logo Spread Body Striped Circle Pittsburgh Penguins Leggings,//cdn.shopify.com/s/files/1/1635/1491/products/Pittsburgh_Penguins_copy_320X320.jpg?v=1548382528
Through Great Logo Spread Body Striped Circle Milwaukee Brewers Leggings,//cdn.shopify.com/s/files/1/1635/1491/products/Milwaukee_Brewers_f746cbc9-2632-4d61-9d3b-15efd3124c57_320X320.jpg?v=1548386763
Through Great Logo Spread Body Striped Circle Chicago Cubs Leggings,//cdn.shopify.com/s/files/1/1635/1491/products/Chicago_Cubs_97bd2f7a-f7f6-4ee2-a71c-fcdadd7cfe33_320X320.jpg?v=1548385366
Cosy Seamless Border Wonderful LSU Tigers Leggings,//cdn.shopify.com/s/files/1/1635/1491/products/LSU_Tigers_320X320.jpg?v=1548313299
Cosy Seamless Border Wonderful Milwaukee Brewers Leggings,//cdn.shopify.com/s/files/1/1635/1491/products/Milwaukee_Brewers_320X320.jpg?v=1548313928
Cosy Seamless Border Wonderful Pittsburgh Steelers Leggings,//cdn.shopify.com/s/files/1/1635/1491/products/Pittsburgh_Steelers_320X320.jpg?v=1548314547
Cosy Seamless Border Wonderful Oakland Raiders Leggings,//cdn.shopify.com/s/files/1/1635/1491/products/Oakland_Raiders_320X320.jpg?v=1548314522
New Single Small Line Circle Stylish Fashion Houston Astros Leggings,//cdn.shopify.com/s/files/1/1635/1491/products/7f5ebdf4-0f11-46cf-8010-d4a34a29ee40_320X320.jpg?v=1554563459
Dizzy Motion Zig Zag Vegas Golden Knights Leggings,//cdn.shopify.com/s/files/1/1635/1491/products/Vegas_Golden_Knights_342f05e5-0cdb-4cac-bdc4-2050e234a9b9_320X320.jpg?v=1553833923
Dizzy Motion Zig Zag New England Patriots Leggings,//cdn.shopify.com/s/files/1/1635/1491/products/New_England_Patriots_eb229bef-907e-40b7-b1ed-572e798b31d2_320X320.jpg?v=1553833885
New Fashion Gorgeous Fitting Fabulous San Francisco 49ers Leggings,//cdn.shopify.com/s/files/1/1635/1491/products/1409b45a-0274-4a50-953e-13bad09abeee_320X320.jpg?v=1552885157
New Cosy Seamless Border Wonderful Colorado Avalanche Leggings,//cdn.shopify.com/s/files/1/1635/1491/products/745c5ec0-efff-43a0-90e4-7358fd037982_320X320.jpg?v=1552277900
Curly Line Charming Daily Fashion Chicago Bears Leggings,//cdn.shopify.com/s/files/1/1635/1491/products/85d63e21-7d6e-43df-913d-9a8939490c09_320X320.jpg?v=1551155916
Curly Line Charming Daily Fashion Kansas City Chiefs Leggings,//cdn.shopify.com/s/files/1/1635/1491/products/933855b3-9dc1-4416-bc7f-13329f2bdb08_320X320.jpg?v=1551156176
Curly Line Charming Daily Fashion Oakland Raiders Leggings,//cdn.shopify.com/s/files/1/1635/1491/products/d37dfe02-8ad1-46d2-ba96-fa06c6d56696_320X320.jpg?v=1551156488
Curly Line Charming Daily Fashion Tampa Bay Buccaneers Leggings,//cdn.shopify.com/s/files/1/1635/1491/products/6d79d1a6-e36b-4ed2-8997-0f2bb219a05f_320X320.jpg?v=1551156694
Curly Line Charming Daily Fashion Houston Astros Leggings,//cdn.shopify.com/s/files/1/1635/1491/products/ce2073ea-0287-4370-ba83-bafcc9d97425_320X320.jpg?v=1551153401
Straight Cute Beautiful Attractive New York Giants Leggings,//cdn.shopify.com/s/files/1/1635/1491/products/8a7d26d6-e57d-472d-9b9e-e0915561fcb1_320X320.jpg?v=1550731318
Straight Cute Beautiful Attractive Miami Dolphins Leggings,//cdn.shopify.com/s/files/1/1635/1491/products/0eee3392-4eae-4deb-a183-35c020af27d4_320X320.jpg?v=1550730976
Straight Cute Beautiful Attractive Kansas City Chiefs Leggings,//cdn.shopify.com/s/files/1/1635/1491/products/f5ef0d23-0dd9-459f-b7e0-f6c624a1c5d0_320X320.jpg?v=1550730905
Straight Cute Beautiful Attractive Buffalo Bills Leggings,//cdn.shopify.com/s/files/1/1635/1491/products/c3925729-bad1-4e63-a7a5-0681f696bad0_320X320.jpg?v=1550728042
Cool Air Lighten Attractive Kind Oakland Athletics Leggings,//cdn.shopify.com/s/files/1/1635/1491/products/Oakland_Athletics_b7403364-976a-4737-b476-f145659a780a_320X320.jpg?v=1550718635
Straight Cute Beautiful Attractive Akron Zips Leggings,//cdn.shopify.com/s/files/1/1635/1491/products/Akron_Zips_b3fd3fae-6387-4528-b788-f24a62f6dbb5_320X320.jpg?v=1550659347
Straight Cute Beautiful Attractive Toronto Blue Jays Leggings,//cdn.shopify.com/s/files/1/1635/1491/products/Toronto_Blue_Jays_67d6fef0-3adc-42c3-a890-ee025794906c_320X320.jpg?v=1550656538
Straight Cute Beautiful Attractive Minnesota Twins Leggings,//cdn.shopify.com/s/files/1/1635/1491/products/Minnesota_Twins_cd6a012b-2329-4bd3-8bf8-acc3da213a5b_320X320.jpg?v=1550656762
Straight Cute Beautiful Attractive Colorado Rockies Leggings,//cdn.shopify.com/s/files/1/1635/1491/products/Colorado_Rockies_274744c9-9f40-4f39-a753-0047736931a8_320X320.jpg?v=1550656568
Incredible Patterns Luxury Nice Vegas Golden Knights Leggings,//cdn.shopify.com/s/files/1/1635/1491/products/XLN-22923RIGHT_320X320.png?v=1550651710
Incredible Patterns Luxury Nice Cincinnati Bearcats Leggings,//cdn.shopify.com/s/files/1/1635/1491/products/Cincinnati_Bearcats_LR_36ffe052-80b0-4157-9eff-ed0c75c6ce50_320X320.jpg?v=1550646289
Charming Lovely Little Dots Along Body St. Louis Blues Leggings,//cdn.shopify.com/s/files/1/1635/1491/products/St._Louis_Blues_0f5f2657-0a02-41c7-b7fd-ad6f4594a73c_320X320.jpg?v=1550633235
Charming Lovely Little Dots Along Body New England Patriots Leggings,//cdn.shopify.com/s/files/1/1635/1491/products/New_England_Patriots_d305084e-db0d-4ce0-a2ec-2bc1dd3c4af2_320X320.jpg?v=1550629506
Charming Lovely Little Dots Along Body Oakland Athletics Leggings,//cdn.shopify.com/s/files/1/1635/1491/products/Oakland_Athletics_4ef097b1-99c6-4ae9-9c9d-bd479f8ad50e_320X320.jpg?v=1550569413
Camo Sporty Trending Fashion Fabulous Tampa Bay Lightning Leggings,//cdn.shopify.com/s/files/1/1635/1491/products/Tampa_Bay_Lightning_8ff902ce-92d8-45de-a816-774a91256bbd_320X320.jpg?v=1550563975
Camo Sporty Trending Fashion Fabulous Ohio State Buckeyes Leggings,//cdn.shopify.com/s/files/1/1635/1491/products/Ohio_State_Buckeyes_1d14093b-c9ea-41fe-b240-5ccc80ba92c7_320X320.jpg?v=1550551693
Camo Sporty Trending Fashion Fabulous Georgia Tech Yellow Jackets Leggings,//cdn.shopify.com/s/files/1/1635/1491/products/Georgia_Tech_Yellow_Jackets_649e2a94-e7b8-497c-b7ab-aef7571c3608_320X320.jpg?v=1550551790
Cosy Seamless Border Wonderful Cincinnati Bearcats Leggings,//cdn.shopify.com/s/files/1/1635/1491/products/Cincinnati_Bearcats_320X320.jpg?v=1550203055
Cosy Seamless Border Wonderful Colorado Avalanche Leggings,//cdn.shopify.com/s/files/1/1635/1491/products/Colorado_Avalanche_f3e14203-012b-4611-bebc-3451ceeca436_320X320.jpg?v=1550203069
Cosy Seamless Border Wonderful Chicago Bears Leggings,//cdn.shopify.com/s/files/1/1635/1491/products/Chicago_Bears_8bf3dbcf-bd2b-4807-8a62-4b867338bb83_320X320.jpg?v=1550203046
Boho Tampa Bay Buccaneers Leggings With Fantastic Art,//cdn.shopify.com/s/files/1/1635/1491/products/Tampa_Bay_Buccaneers_97f16cb8-c874-45f0-bbdd-01585b6e62c1_320X320.jpg?v=1548395026
Boho Philadelphia Eagles Leggings With Fantastic Art,//cdn.shopify.com/s/files/1/1635/1491/products/Philadelphia_Eagles_92e04bb5-5c93-4bfa-bc2e-c9e707ee2d4a_320X320.jpg?v=1548395016
Boho New York Giants Leggings With Fantastic Art,//cdn.shopify.com/s/files/1/1635/1491/products/New_York_Giants_08307673-d0ef-4714-9558-685e7b1426ec_320X320.jpg?v=1548395009
Boho Minnesota Vikings Leggings With Fantastic Art,//cdn.shopify.com/s/files/1/1635/1491/products/Minnesota_Vikings_93f2aa6d-56e8-409f-92b1-04d4efec2308_320X320.jpg?v=1548393620
Boho Green Bay Packers Leggings With Fantastic Art,//cdn.shopify.com/s/files/1/1635/1491/products/Green_Bay_Packers_6e10efda-87ba-4fd5-906f-0d2980f0edb4_320X320.jpg?v=1548392979
Boho Cincinnati Bengals Leggings With Fantastic Art,//cdn.shopify.com/s/files/1/1635/1491/products/Cincinnati_Bengals_2bbf33ad-a7ca-4165-be65-77509ceaa779_320X320.jpg?v=1548392969
Boho Oklahoma Sooners Leggings With Fantastic Art,//cdn.shopify.com/s/files/1/1635/1491/products/Oklahoma_Sooners_863bae47-5b70-4aaf-ae32-9170af44d04c_320X320.jpg?v=1548391700
Twins Logo Minnesota Vikings Leggings For Fans,//cdn.shopify.com/s/files/1/1635/1491/products/6dbf62b2-246f-43c2-9e70-8daf4282cf82_320X320.jpg?v=1543915962
Twins Logo Alabama Crimson Tide Leggings For Fans,//cdn.shopify.com/s/files/1/1635/1491/products/7b69d657-6548-4038-b93e-9c64f2241320_320X320.jpg?v=1543910869
Through Great Logo Spread Body Striped Circle Minnesota Twins Leggings,//cdn.shopify.com/s/files/1/1635/1491/products/Minnesota_Twins_206aa4c4-a3ac-4aec-b09f-cbb02f73e81f_320X320.jpg?v=1548386766
Single Small Line Circle Stylish Fashion Atlanta Falcons Leggings,//cdn.shopify.com/s/files/1/1635/1491/products/Atlanta_Falcons_GST_406648cd-252a-4dc6-81ca-382e36ef2a19_320X320.jpg?v=1548322370
Mysterious Smoke Colors Alabama Crimson Tide Leggings,//cdn.shopify.com/s/files/1/1635/1491/products/481ffeda-28dd-4425-8535-4df20df6a77d_320X320.jpg?v=1543900237
Great Urban Night Scene Ohio State Buckeyes Leggings,//cdn.shopify.com/s/files/1/1635/1491/products/54cf615d-7819-4412-a887-a16849db7457_320X320.jpg?v=1546008130
Great Urban Night Scene Nashville Predators Leggings,//cdn.shopify.com/s/files/1/1635/1491/products/10ed2b10-631d-41c8-9a05-5231857299ee_320X320.jpg?v=1546007816
Amazing Blue Jeans Chicago Bears Leggings,//cdn.shopify.com/s/files/1/1635/1491/products/7c8571c9-29d9-4969-8f42-dd3d329dafdc_320X320.jpg?v=1545916045
Fashion Gorgeous Fitting Fabulous Washington Capitals Leggings,//cdn.shopify.com/s/files/1/1635/1491/products/Washington_Capitals_LR_ec7f925b-ea90-40af-a20d-ab4f9b2263c7_320X320.jpg?v=1548321018
Fashion Gorgeous Fitting Fabulous Tampa Bay Lightning Leggings,//cdn.shopify.com/s/files/1/1635/1491/products/Tampa_Bay_Lightning_LR_852ffbcf-3281-46b7-8042-a478bf96a881_320X320.jpg?v=1548320984
Fashion Gorgeous Fitting Fabulous Tampa Bay Buccaneers Leggings,//cdn.shopify.com/s/files/1/1635/1491/products/Tampa_Bay_Buccaneers_LR_834c7a41-fb42-4223-88f9-0023e5b26690_320X320.jpg?v=1548320981
Fashion Gorgeous Fitting Fabulous St. Louis Blues Leggings,//cdn.shopify.com/s/files/1/1635/1491/products/St._Louis_Blues_LR_03837557-1e91-439a-ae63-1fe923c83efb_320X320.jpg?v=1548320975
Fashion Gorgeous Fitting Fabulous Seattle Seahawks Leggings,//cdn.shopify.com/s/files/1/1635/1491/products/Seattle_Seahawks_LR_320X320.jpg?v=1548320967
Fashion Gorgeous Fitting Fabulous Edmonton Oilers Leggings,//cdn.shopify.com/s/files/1/1635/1491/products/Edmonton_Oilers_LR_cb6fef78-e46d-4a18-aa48-c7de879bcfaf_320X320.jpg?v=1548319114
Fashion Gorgeous Fitting Fabulous Dallas Stars Leggings,//cdn.shopify.com/s/files/1/1635/1491/products/Dallas_Stars_LR_5282f6b7-1a4e-4563-897c-af26133bbfdf_320X320.jpg?v=1548318447
Fashion Gorgeous Fitting Fabulous Colorado Avalanche Leggings,//cdn.shopify.com/s/files/1/1635/1491/products/Colorado_Avalanche_LR_f699a2b7-0884-45fb-a3d7-0a0d5f9a5062_320X320.jpg?v=1548318429
Single Small Line Circle Stylish Fashion Washington Capitals Leggings,//cdn.shopify.com/s/files/1/1635/1491/products/Washington_Capitals_LR_320X320.jpg?v=1548326717
Fashion Gorgeous Fitting Fabulous Boston Bruins Leggings,//cdn.shopify.com/s/files/1/1635/1491/products/Boston_Bruins_LR_e096b555-8775-42b5-9623-291134cb22da_320X320.jpg?v=1548317902
Fashion Gorgeous Fitting Fabulous Buffalo Sabres Leggings,//cdn.shopify.com/s/files/1/1635/1491/products/Buffalo_Sabres_LR_0c3dced0-fad7-4055-80bc-b239a80e3db9_320X320.jpg?v=1548317915
Single Small Line Circle Stylish Fashion San Jose Sharks Leggings,//cdn.shopify.com/s/files/1/1635/1491/products/San_Jose_Sharks_LR_320X320.jpg?v=1548326276
Single Small Line Circle Stylish Fashion Buffalo Sabres Leggings,//cdn.shopify.com/s/files/1/1635/1491/products/Buffalo_Sabres_LR_320X320.jpg?v=1548322791
Single Small Line Circle Stylish Fashion San Francisco 49ers Leggings,//cdn.shopify.com/s/files/1/1635/1491/products/San_Francisco_49ers_GS_320X320.jpg?v=1548326271
Single Small Line Circle Stylish Fashion Pittsburgh Steelers Leggings,//cdn.shopify.com/s/files/1/1635/1491/products/Pittsburgh_Steelers_LR_320X320.jpg?v=1548326014
Single Small Line Circle Stylish Fashion Oakland Raiders Leggings,//cdn.shopify.com/s/files/1/1635/1491/products/Oakland_Raiders_LR_320X320.jpg?v=1548325375
Single Small Line Circle Stylish Fashion New York Giants Leggings,//cdn.shopify.com/s/files/1/1635/1491/products/New_York_Giants_GS_320X320.jpg?v=1548325356
Single Small Line Circle Stylish Fashion Minnesota Vikings Leggings,//cdn.shopify.com/s/files/1/1635/1491/products/Minnesota_Vikings_GST_320X320.jpg?v=1548325334
Single Small Line Circle Stylish Fashion Cincinnati Bengals Leggings,//cdn.shopify.com/s/files/1/1635/1491/products/Cincinnati_Bengals_LR_c0261c92-a866-4294-b9dd-750fc3bcb440_320X320.jpg?v=1548323602
Single Small Line Circle Stylish Fashion LSU Tigers  Leggings,//cdn.shopify.com/s/files/1/1635/1491/products/LSU_Tigers_LR_5e932cd9-fcc8-414f-a5ff-3a1d35f12e4a_320X320.jpg?v=1548324731
Single Small Line Circle Stylish Fashion Georgia Tech Yellow Jackets Leggings,//cdn.shopify.com/s/files/1/1635/1491/products/Georgia_Tech_Yellow_Jackets_LR_b3817b46-f9d7-45e3-846c-4a8a66317ba1_320X320.jpg?v=1548324258
Single Small Line Circle Stylish Fashion Cincinnati Bearcats Leggings,//cdn.shopify.com/s/files/1/1635/1491/products/Cincinnati_Bearcats_LR_e0697c84-106a-4a80-b9d1-21f4992eb7e7_320X320.jpg?v=1548323599
Single Small Line Circle Stylish Fashion Alabama Crimson Tide Leggings,//cdn.shopify.com/s/files/1/1635/1491/products/Alabama_Crimson_Tide_GST_d3b676c3-9de9-45c1-aff2-32cd6474db96_320X320.jpg?v=1548322347
Single Small Line Circle Stylish Fashion Toronto Blue Jays Leggings,//cdn.shopify.com/s/files/1/1635/1491/products/Toronto_Blue_Jays_GS_59de1484-3d22-49b9-88ac-74a8de9e4b87_320X320.jpg?v=1548326702
Single Small Line Circle Stylish Fashion Pittsburgh Pirates Leggings,//cdn.shopify.com/s/files/1/1635/1491/products/Pittsburgh_Pirates_LR_395be89e-e98e-4c36-a2cc-2a001e3a3b21_320X320.jpg?v=1548326010
Single Small Line Circle Stylish Fashion Oakland Athletics Leggings,//cdn.shopify.com/s/files/1/1635/1491/products/Oakland_Athletics_GST_037fb337-465e-4072-a564-ffc83c08fdeb_320X320.jpg?v=1548325373
Single Small Line Circle Stylish Fashion Milwaukee Brewers Leggings,//cdn.shopify.com/s/files/1/1635/1491/products/Milwaukee_Brewers_LR_a15d6d1f-3e8b-489e-b1bd-8c3861f2321a_320X320.jpg?v=1548325327
Single Small Line Circle Stylish Fashion Chicago White Sox Leggings,//cdn.shopify.com/s/files/1/1635/1491/products/Chicago_White_Sox_LR_3ad8bbbd-5b8b-4f5f-b59b-16a61e377e07_320X320.jpg?v=1548323596
Fashion Gorgeous Fitting Fabulous Akron Zips Leggings,//cdn.shopify.com/s/files/1/1635/1491/products/Akron_Zips_LR_320X320.jpg?v=1548317527
Fashion Gorgeous Fitting Fabulous South Florida Bulls Leggings,//cdn.shopify.com/s/files/1/1635/1491/products/South_Florida_Bulls_LR_320X320.jpg?v=1548320972
Fashion Gorgeous Fitting Fabulous Los Angeles Angels Leggings,//cdn.shopify.com/s/files/1/1635/1491/products/Los_Angeles_Angels_LR_320X320.jpg?v=1548319820
Fashion Gorgeous Fitting Fabulous Houston Astros Leggings,//cdn.shopify.com/s/files/1/1635/1491/products/Houston_Astros_LR_320X320.jpg?v=1548319135
Through Great Logo Spread Body Striped Circle Ottawa Senators Leggings,//cdn.shopify.com/s/files/1/1635/1491/products/Ottawa_Senators_copy_320X320.jpg?v=1548382518
Through Great Logo Spread Body Striped Circle Nashville Predators Leggings,//cdn.shopify.com/s/files/1/1635/1491/products/Nashville_Predators_copy_320X320.jpg?v=1548382492
Through Great Logo Spread Body Striped Circle Edmonton Oilers Leggings,//cdn.shopify.com/s/files/1/1635/1491/products/Edmonton_Oilers_copy_320X320.jpg?v=1548381721
Through Great Logo Spread Body Striped Circle Washington Redskins Leggings,//cdn.shopify.com/s/files/1/1635/1491/products/Washington_Redskins_copy_320X320.jpg?v=1548383694
Through Great Logo Spread Body Striped Circle Philadelphia Eagles Leggings,//cdn.shopify.com/s/files/1/1635/1491/products/Philadelphia_Eagles_copy_320X320.jpg?v=1548382520
Through Great Logo Spread Body Striped Circle New York Giants Leggings,//cdn.shopify.com/s/files/1/1635/1491/products/New_York_Giants_copy_320X320.jpg?v=1548382504
Through Great Logo Spread Body Striped Circle Los Angeles Rams Leggings,//cdn.shopify.com/s/files/1/1635/1491/products/Los_Angeles_Rams_copy_320X320.jpg?v=1548382474
Through Great Logo Spread Body Striped Circle Detroit Lions Leggings,//cdn.shopify.com/s/files/1/1635/1491/products/Detroit_Lions_copy_320X320.jpg?v=1548381716
Through Great Logo Spread Body Striped Circle Cincinnati Bengals Leggings,//cdn.shopify.com/s/files/1/1635/1491/products/Cincinnati_Bengals_copy_320X320.jpg?v=1548381697
Through Great Logo Spread Body Striped Circle Arkansas Razorbacks Leggings,//cdn.shopify.com/s/files/1/1635/1491/products/Arkansas_Razorbacks_048192f9-c4cc-4a79-a928-08596cec554c_320X320.jpg?v=1548384245
Through Great Logo Spread Body Striped Circle Toronto Blue Jays Leggings,//cdn.shopify.com/s/files/1/1635/1491/products/Toronto_Blue_Jays_839be082-d3c4-4336-90ab-a512e8709760_320X320.jpg?v=1548386842
Through Great Logo Spread Body Striped Circle Philadelphia Phillies Leggings,//cdn.shopify.com/s/files/1/1635/1491/products/Philadelphia_Phillies_66be241b-1b61-4290-ae14-8654ef899dce_320X320.jpg?v=1548386790
Through Great Logo Spread Body Striped Circle New York Yankees Leggings,//cdn.shopify.com/s/files/1/1635/1491/products/New_York_Yankees_234b0df5-546c-4782-854d-255624f2a248_320X320.jpg?v=1548386775
Through Great Logo Spread Body Striped Circle Detroit Tigers Leggings,//cdn.shopify.com/s/files/1/1635/1491/products/Detroit_Tigers_b3d2449f-e1c4-4d71-9e52-377641da1236_320X320.jpg?v=1548385304
Through Great Logo Spread Body Striped Circle Chicago White Sox Leggings,//cdn.shopify.com/s/files/1/1635/1491/products/CHICAGO_WHITE_SOX_38fbba53-88ef-4975-be97-3b23b0297e22_320X320.jpg?v=1548385361
Cosy Seamless Border Wonderful Washington Capitals Leggings,//cdn.shopify.com/s/files/1/1635/1491/products/Washington_Capitals_320X320.jpg?v=1548315150
Cosy Seamless Border Wonderful San Jose Sharks Leggings,//cdn.shopify.com/s/files/1/1635/1491/products/San_Jose_Sharks_320X320.jpg?v=1548315088
Cosy Seamless Border Wonderful Philadelphia Flyers Leggings,//cdn.shopify.com/s/files/1/1635/1491/products/Philadelphia_Flyers_320X320.jpg?v=1548314536
Cosy Seamless Border Wonderful Los Angeles Dodgers Leggings,//cdn.shopify.com/s/files/1/1635/1491/products/Los_Angeles_Dodgers_320X320.jpg?v=1548313296
Cosy Seamless Border Wonderful Detroit Tigers Leggings,//cdn.shopify.com/s/files/1/1635/1491/products/Detroit_Tigers_320X320.jpg?v=1548312696
Cosy Seamless Border Wonderful New York Giants Leggings,//cdn.shopify.com/s/files/1/1635/1491/products/New_York_Giants_320X320.jpg?v=1548313956
Dizzy Motion Zig Zag Washington Capitals Leggings,//cdn.shopify.com/s/files/1/1635/1491/products/Washington_Capitals_40aa9773-c4f8-4d06-be23-9190ab017978_320X320.jpg?v=1553833926
Dizzy Motion Zig Zag Tampa Bay Lightning Leggings,//cdn.shopify.com/s/files/1/1635/1491/products/Tampa_Bay_Lightning_931ef350-5206-444b-9c7a-5a7522d5c81b_320X320.jpg?v=1553833925
Dizzy Motion Zig Zag St. Louis Blues Leggings,//cdn.shopify.com/s/files/1/1635/1491/products/St._Louis_Blues_007bf017-7031-470a-a01f-76a5d7b6b732_320X320.jpg?v=1553833922
Dizzy Motion Zig Zag San Jose Sharks Leggings,//cdn.shopify.com/s/files/1/1635/1491/products/San_Jose_Sharks_f343fe26-3f18-4bd9-adea-d2b6225a7e01_320X320.jpg?v=1553833921
Dizzy Motion Zig Zag Pittsburgh Penguins Leggings,//cdn.shopify.com/s/files/1/1635/1491/products/Pittsburgh_Penguins_fcbf5182-5a3b-4fb5-bc38-7f0c5d519158_320X320.jpg?v=1553833919
Dizzy Motion Zig Zag Philadelphia Flyers Leggings,//cdn.shopify.com/s/files/1/1635/1491/products/Philadelphia_Flyers_a3842a51-0143-49c0-882f-47d445ec34dc_320X320.jpg?v=1553833918
Dizzy Motion Zig Zag New York Rangers Leggings,//cdn.shopify.com/s/files/1/1635/1491/products/New_York_Rangers_dd85b9e4-ad3f-4860-8a9e-dd751ec87523_320X320.jpg?v=1553833916
Dizzy Motion Zig Zag New York Islanders Leggings,//cdn.shopify.com/s/files/1/1635/1491/products/New_York_Islanders_c983a972-8459-4c96-b0c3-d748b0efc407_320X320.jpg?v=1553833915
Dizzy Motion Zig Zag New Jersey Devils Leggings,//cdn.shopify.com/s/files/1/1635/1491/products/New_Jersey_Devils_9de08df9-b03e-4a1e-9feb-f82797e3696a_320X320.jpg?v=1553833914
Dizzy Motion Zig Zag Nashville Predators Leggings,//cdn.shopify.com/s/files/1/1635/1491/products/Nashville_Predators_889298b3-40e4-4102-a04b-e8d9b222a734_320X320.jpg?v=1553833912
Dizzy Motion Zig Zag Detroit Red Wings Leggings,//cdn.shopify.com/s/files/1/1635/1491/products/Detroit_Red_Wings_d56af70d-7b7c-42ba-898f-9a16b1199414_320X320.jpg?v=1553833911
Dizzy Motion Zig Zag Minnesota Wild Leggings,//cdn.shopify.com/s/files/1/1635/1491/products/Minnesota_Wild_cdfa5e5e-fcb7-4608-93fd-87eb6af3edbb_320X320.jpg?v=1553833909
Dizzy Motion Zig Zag Colorado Avalanche Leggings,//cdn.shopify.com/s/files/1/1635/1491/products/Colorado_Avalanche_28c57565-edd7-4d28-9189-ab521ce8d72e_320X320.jpg?v=1553833908
