name,image
Curly Line Charming Daily Fashion New York Rangers Leggings,//cdn.shopify.com/s/files/1/1635/1491/products/b822baf7-17b9-4e30-af81-293c489ec4f0_320X320.jpg?v=1551158918
Curly Line Charming Daily Fashion New York Islanders Leggings,//cdn.shopify.com/s/files/1/1635/1491/products/e17c57e2-f17c-4004-99da-55917c768f61_320X320.jpg?v=1551158914
Curly Line Charming Daily Fashion New Jersey Devils Leggings,//cdn.shopify.com/s/files/1/1635/1491/products/f1b4bdee-82e9-4fef-bc7e-9392a27494cf_320X320.jpg?v=1551158778
Curly Line Charming Daily Fashion Nashville Predators Leggings,//cdn.shopify.com/s/files/1/1635/1491/products/14d7c398-9d15-4a4e-a2a6-2013a5cb2fa2_320X320.jpg?v=1551158780
Curly Line Charming Daily Fashion Minnesota Wild Leggings,//cdn.shopify.com/s/files/1/1635/1491/products/b1677750-0094-4e4a-82c1-39992a6d7fe9_320X320.jpg?v=1551158649
Curly Line Charming Daily Fashion Detroit Red Wings Leggings,//cdn.shopify.com/s/files/1/1635/1491/products/eb115776-a57b-41f9-9844-acde32edd05c_320X320.jpg?v=1551158678
Curly Line Charming Daily Fashion Colorado Avalanche Leggings,//cdn.shopify.com/s/files/1/1635/1491/products/120841fb-fc64-4aa4-9630-da2b25b62bd0_320X320.jpg?v=1551158532
Curly Line Charming Daily Fashion Chicago Blackhawks Leggings,//cdn.shopify.com/s/files/1/1635/1491/products/41b16e45-569b-416b-92ab-926d71d775fb_320X320.jpg?v=1551158536
Curly Line Charming Daily Fashion Carolina Hurricanes Leggings,//cdn.shopify.com/s/files/1/1635/1491/products/5c23c5d2-0aca-4d3a-807d-688aaa70f442_320X320.jpg?v=1551158408
Curly Line Charming Daily Fashion Buffalo Sabres Leggings,//cdn.shopify.com/s/files/1/1635/1491/products/ec9b536a-7bd5-410b-a0e0-1a1f068d1414_320X320.jpg?v=1551158351
Curly Line Charming Daily Fashion Boston Bruins Leggings,//cdn.shopify.com/s/files/1/1635/1491/products/838d2dcf-c0dc-4611-b7e3-c57bf2cbb49b_320X320.jpg?v=1551158306
Curly Line Charming Daily Fashion Anaheim Ducks Leggings,//cdn.shopify.com/s/files/1/1635/1491/products/c81a8e48-a807-4a82-95cb-236f8dff77bf_320X320.jpg?v=1551158228
Curly Line Charming Daily Fashion Arizona Cardinals Leggings,//cdn.shopify.com/s/files/1/1635/1491/products/b55734ed-1507-4bf3-8aa1-fa0d47dacc3a_320X320.jpg?v=1551155177
Curly Line Charming Daily Fashion Atlanta Falcons Leggings,//cdn.shopify.com/s/files/1/1635/1491/products/1307b22b-7aa7-4afb-b2df-6f8f2a995d93_320X320.jpg?v=1551155393
Curly Line Charming Daily Fashion Baltimore Ravens Leggings,//cdn.shopify.com/s/files/1/1635/1491/products/103ad907-4687-4eda-a580-2900f57fe2ce_320X320.jpg?v=1551155835
Curly Line Charming Daily Fashion Buffalo Bills Leggings,//cdn.shopify.com/s/files/1/1635/1491/products/835cf96e-c956-4221-826d-e538e1023a4d_320X320.jpg?v=1551155867
Curly Line Charming Daily Fashion Carolina Panthers Leggings,//cdn.shopify.com/s/files/1/1635/1491/products/4361c1c6-9f18-4750-aa2a-ad313ca1636d_320X320.jpg?v=1551155890
Curly Line Charming Daily Fashion Cincinnati Bengals Leggings,//cdn.shopify.com/s/files/1/1635/1491/products/7ad89de4-dbbe-4c98-8bc7-247d95732a74_320X320.jpg?v=1551155946
Curly Line Charming Daily Fashion Denver Broncos Leggings,//cdn.shopify.com/s/files/1/1635/1491/products/f02e97ca-7e0f-45c8-9a87-4a9db67e739e_320X320.jpg?v=1551156039
Curly Line Charming Daily Fashion Detroit Lions Leggings,//cdn.shopify.com/s/files/1/1635/1491/products/00826fbf-424e-4cc1-bd33-51b630bf4bee_320X320.jpg?v=1551156003
Curly Line Charming Daily Fashion Green Bay Packers Leggings,//cdn.shopify.com/s/files/1/1635/1491/products/52820b6c-4027-4eb0-afe4-97bff28d5df1_320X320.jpg?v=1551156059
Curly Line Charming Daily Fashion Houston Texans Leggings,//cdn.shopify.com/s/files/1/1635/1491/products/20f0d5da-0608-4ee6-a513-c6ffdbd790eb_320X320.jpg?v=1551156089
Curly Line Charming Daily Fashion Indianapolis Colts Leggings,//cdn.shopify.com/s/files/1/1635/1491/products/1abeca86-856b-403e-9401-0648b857a382_320X320.jpg?v=1551156115
Curly Line Charming Daily Fashion Jacksonville Jaguars Leggings,//cdn.shopify.com/s/files/1/1635/1491/products/e2cb9d93-e7dc-42c5-ac0f-37f77cd29404_320X320.jpg?v=1551156147
Curly Line Charming Daily Fashion Los Angeles Chargers Leggings,//cdn.shopify.com/s/files/1/1635/1491/products/6022b7b6-3e1a-4a4c-b69e-4955c2720b80_320X320.jpg?v=1551156208
Curly Line Charming Daily Fashion Los Angeles Rams Leggings,//cdn.shopify.com/s/files/1/1635/1491/products/a22b0132-95fc-4427-8630-a036f0081d60_320X320.jpg?v=1551156205
Curly Line Charming Daily Fashion Miami Dolphins Leggings,//cdn.shopify.com/s/files/1/1635/1491/products/f1c4a729-f10b-49f5-835f-f4bf5ad5e2e1_320X320.jpg?v=1551156278
Curly Line Charming Daily Fashion Minnesota Vikings Leggings,//cdn.shopify.com/s/files/1/1635/1491/products/21a9e5f6-7a33-458a-9391-0d418abbb21c_320X320.jpg?v=1551156305
Curly Line Charming Daily Fashion New England Patriots Leggings,//cdn.shopify.com/s/files/1/1635/1491/products/eedef200-9d41-4c5d-bb93-33d159c5bf2a_320X320.jpg?v=1551156349
Curly Line Charming Daily Fashion New Orleans Saints Leggings,//cdn.shopify.com/s/files/1/1635/1491/products/67e7474f-e7b2-4bd4-b9c5-4fbe6b17d408_320X320.jpg?v=1551156375
Curly Line Charming Daily Fashion New York Giants Leggings,//cdn.shopify.com/s/files/1/1635/1491/products/6f27e3cc-28ef-4716-9923-426f458e12a2_320X320.jpg?v=1551156457
Curly Line Charming Daily Fashion New York Jets Leggings,//cdn.shopify.com/s/files/1/1635/1491/products/df8bb417-b229-48ab-833f-de8fb5ee4f99_320X320.jpg?v=1551156428
Curly Line Charming Daily Fashion Philadelphia Eagles Leggings,//cdn.shopify.com/s/files/1/1635/1491/products/d1cdcf0a-367d-4a30-8d7c-ac1d1655a77e_320X320.jpg?v=1551156520
Curly Line Charming Daily Fashion Pittsburgh Steelers Leggings,//cdn.shopify.com/s/files/1/1635/1491/products/8789d033-d742-46eb-ac96-b5d9811c17cc_320X320.jpg?v=1551156559
Curly Line Charming Daily Fashion Seattle Seahawks Leggings,//cdn.shopify.com/s/files/1/1635/1491/products/51b5f26f-0368-4f37-bf08-289ddd34afdc_320X320.jpg?v=1551156627
Curly Line Charming Daily Fashion Tennessee Titans Leggings,//cdn.shopify.com/s/files/1/1635/1491/products/1171b454-2da7-4b79-90d4-3ca09ee5276d_320X320.jpg?v=1551156718
Curly Line Charming Daily Fashion Washington Redskins Leggings,//cdn.shopify.com/s/files/1/1635/1491/products/28c7f576-07cd-438f-bf02-12032a2f5bba_320X320.jpg?v=1551156748
Curly Line Charming Daily Fashion UCLA Bruins Leggings,//cdn.shopify.com/s/files/1/1635/1491/products/71b55c81-ed98-49c5-9354-91bb8d274b4c_320X320.jpg?v=1551155596
Curly Line Charming Daily Fashion Texas Longhorns Leggings,//cdn.shopify.com/s/files/1/1635/1491/products/9a96f6d6-d713-48d6-9e1f-110029ca9565_320X320.jpg?v=1551154921
Curly Line Charming Daily Fashion Tennessee Volunteers Leggings,//cdn.shopify.com/s/files/1/1635/1491/products/14f5978b-ab7a-4449-a757-919406374051_320X320.jpg?v=1551154897
Curly Line Charming Daily Fashion Oklahoma Sooners Leggings,//cdn.shopify.com/s/files/1/1635/1491/products/a56e9e07-811c-489c-bdb1-3211895c92a1_320X320.jpg?v=1551154839
Curly Line Charming Daily Fashion Ohio State Buckeyes Leggings,//cdn.shopify.com/s/files/1/1635/1491/products/784bb426-da00-48e5-a1dc-6c085d22aab7_320X320.jpg?v=1551154807
Curly Line Charming Daily Fashion Notre Dame Fighting Irish Leggings,//cdn.shopify.com/s/files/1/1635/1491/products/b6cbcd8b-abca-4bc8-9ad5-a89e43f90a9e_320X320.jpg?v=1551154800
Curly Line Charming Daily Fashion LSU Tigers Leggings,//cdn.shopify.com/s/files/1/1635/1491/products/601a9af9-91d4-4d3b-a0eb-b6f87f87908f_320X320.jpg?v=1551154769
Curly Line Charming Daily Fashion Florida State Seminoles Leggings,//cdn.shopify.com/s/files/1/1635/1491/products/ce7b467b-9d85-4582-b273-696c0b0ff2e7_320X320.jpg?v=1551154723
Curly Line Charming Daily Fashion Arkansas Razorbacks Leggings,//cdn.shopify.com/s/files/1/1635/1491/products/4e106152-1ca4-437c-aa51-0fbf7cedce02_320X320.jpg?v=1551154719
Curly Line Charming Daily Fashion Arizona Wildcats Leggings,//cdn.shopify.com/s/files/1/1635/1491/products/6fcf4241-73cc-4117-b8ec-b3268f55a0b3_320X320.jpg?v=1551154689
Curly Line Charming Daily Fashion Alabama Crimson Tide Leggings,//cdn.shopify.com/s/files/1/1635/1491/products/1389f19a-93ab-4d5c-9dc0-bea84c66f8ed_320X320.jpg?v=1551154666
Curly Line Charming Daily Fashion New York Mets Leggings,//cdn.shopify.com/s/files/1/1635/1491/products/9558f2bd-4274-4b3a-9044-2736636c5b58_320X320.jpg?v=1551154085
Curly Line Charming Daily Fashion Los Angeles Dodgers Leggings,//cdn.shopify.com/s/files/1/1635/1491/products/29a242a8-0856-4924-8f89-b74d9354d2f6_320X320.jpg?v=1551153417
Curly Line Charming Daily Fashion Detroit Tigers Leggings,//cdn.shopify.com/s/files/1/1635/1491/products/22f2dddd-5f4d-4bcf-b888-06f176d00395_320X320.jpg?v=1551153355
Curly Line Charming Daily Fashion Cleveland Indians Leggings,//cdn.shopify.com/s/files/1/1635/1491/products/9d192e91-5ddb-4e06-89ae-04b0f3b11895_320X320.jpg?v=1551153325
Curly Line Charming Daily Fashion Cincinnati Reds Leggings,//cdn.shopify.com/s/files/1/1635/1491/products/68e96fb8-1aaa-473e-b43e-bccfc237d023_320X320.jpg?v=1551153327
Curly Line Charming Daily Fashion Chicago White Sox Leggings,//cdn.shopify.com/s/files/1/1635/1491/products/5b5c1fd7-2099-422c-bff7-0d27f3117856_320X320.jpg?v=1551153278
Curly Line Charming Daily Fashion Chicago Cubs Leggings,//cdn.shopify.com/s/files/1/1635/1491/products/72654aee-02c1-4c6d-9f15-ce3c3891f136_320X320.jpg?v=1551153246
Curly Line Charming Daily Fashion Baltimore Orioles Leggings,//cdn.shopify.com/s/files/1/1635/1491/products/6dfa35e7-45ea-4524-bdcc-0e51c096e6c5_320X320.jpg?v=1551153163
Curly Line Charming Daily Fashion Milwaukee Brewers Leggings,//cdn.shopify.com/s/files/1/1635/1491/products/47b2d98e-f08b-4220-b7b4-6e3331679b41_320X320.jpg?v=1551153441
Curly Line Charming Daily Fashion Texas Rangers Leggings,//cdn.shopify.com/s/files/1/1635/1491/products/adee4e44-65fd-4db6-a03d-a5cc273a3702_320X320.jpg?v=1551153698
Curly Line Charming Daily Fashion St. Louis Cardinals Leggings,//cdn.shopify.com/s/files/1/1635/1491/products/8d0ef17d-2482-4807-9967-088cab6a8173_320X320.jpg?v=1551153688
Curly Line Charming Daily Fashion San Francisco Giants Leggings,//cdn.shopify.com/s/files/1/1635/1491/products/4ff8b1f3-db4f-4708-80db-e3558f2a861c_320X320.jpg?v=1551153633
Curly Line Charming Daily Fashion Pittsburgh Pirates Leggings,//cdn.shopify.com/s/files/1/1635/1491/products/c3f977a1-084e-40f1-abd6-615addd5a2e4_320X320.jpg?v=1551153628
Curly Line Charming Daily Fashion Philadelphia Phillies Leggings,//cdn.shopify.com/s/files/1/1635/1491/products/2d48f26d-c5d4-488d-892c-ab4c217b33cf_320X320.jpg?v=1551153558
Curly Line Charming Daily Fashion New York Yankees Leggings,//cdn.shopify.com/s/files/1/1635/1491/products/67088399-7dc1-4fd0-bb29-5d1070c59431_320X320.jpg?v=1551153566
Curly Line Charming Daily Fashion Minnesota Twins Leggings,//cdn.shopify.com/s/files/1/1635/1491/products/a0ad9473-d53b-4f6a-80d5-75b3e7292e8e_320X320.jpg?v=1551153531
Curly Line Charming Daily Fashion Atlanta Braves Leggings,//cdn.shopify.com/s/files/1/1635/1491/products/1538f632-93bb-40c7-b714-d53ecf2becd4_320X320.jpg?v=1551148521
Straight Cute Beautiful Attractive Washington Redskins Leggings,//cdn.shopify.com/s/files/1/1635/1491/products/178225d7-097f-4b1d-89d3-d5402a51e4dd_320X320.jpg?v=1550731298
Straight Cute Beautiful Attractive Tennessee Titans Leggings,//cdn.shopify.com/s/files/1/1635/1491/products/51d5abb0-7a73-43dd-8285-aa2939100b98_320X320.jpg?v=1550731271
Straight Cute Beautiful Attractive Tampa Bay Buccaneers Leggings,//cdn.shopify.com/s/files/1/1635/1491/products/e5131d0b-cfcd-444e-93ec-62acb2c32061_320X320.jpg?v=1550731245
Straight Cute Beautiful Attractive Seattle Seahawks Leggings,//cdn.shopify.com/s/files/1/1635/1491/products/0852491f-89ea-4012-a73c-29766c4dd4a4_320X320.jpg?v=1550731207
Straight Cute Beautiful Attractive San Francisco 49ers Leggings,//cdn.shopify.com/s/files/1/1635/1491/products/f3db0a83-4a10-4b91-867e-21ed029ba441_320X320.jpg?v=1550731186
Straight Cute Beautiful Attractive Pittsburgh Steelers Leggings,//cdn.shopify.com/s/files/1/1635/1491/products/862efca0-2feb-4b43-98cd-649702c3071c_320X320.jpg?v=1550731168
Straight Cute Beautiful Attractive Philadelphia Eagles Leggings,//cdn.shopify.com/s/files/1/1635/1491/products/25d53fef-645c-4415-80d7-ed459f1f7d44_320X320.jpg?v=1550731150
Straight Cute Beautiful Attractive Oakland Raiders Leggings,//cdn.shopify.com/s/files/1/1635/1491/products/1ff8e028-7ff0-4763-b91e-0111852f9c8a_320X320.jpg?v=1550731128
Straight Cute Beautiful Attractive New York Jets Leggings,//cdn.shopify.com/s/files/1/1635/1491/products/7d902204-6f0e-4170-8e2c-f91ee84ce227_320X320.jpg?v=1550731085
Straight Cute Beautiful Attractive New Orleans Saints Leggings,//cdn.shopify.com/s/files/1/1635/1491/products/d187d635-78b9-4d69-baf2-e4a8375dfd59_320X320.jpg?v=1550731108
Straight Cute Beautiful Attractive New England Patriots Leggings,//cdn.shopify.com/s/files/1/1635/1491/products/80ae8230-2041-4700-838c-467042085ffe_320X320.jpg?v=1550731021
Straight Cute Beautiful Attractive Minnesota Vikings Leggings,//cdn.shopify.com/s/files/1/1635/1491/products/315d10a6-e53c-4e84-b55e-ed1026582a7c_320X320.jpg?v=1550730999
Straight Cute Beautiful Attractive Los Angeles Rams Leggings,//cdn.shopify.com/s/files/1/1635/1491/products/70de4f03-2acc-4497-82f3-3910cbbab85d_320X320.jpg?v=1550730953
Straight Cute Beautiful Attractive Los Angeles Chargers Leggings,//cdn.shopify.com/s/files/1/1635/1491/products/d6d7d1d6-c955-49e8-a3a5-0778c83a02fe_320X320.jpg?v=1550730927
Straight Cute Beautiful Attractive Jacksonville Jaguars Leggings,//cdn.shopify.com/s/files/1/1635/1491/products/64917929-3fa1-431f-9f67-91881b036224_320X320.jpg?v=1550730879
Straight Cute Beautiful Attractive Indianapolis Colts Leggings,//cdn.shopify.com/s/files/1/1635/1491/products/4e6e2d63-4534-4ec4-84b8-a09ad96dd1c7_320X320.jpg?v=1550730856
Straight Cute Beautiful Attractive Houston Texans Leggings,//cdn.shopify.com/s/files/1/1635/1491/products/83933081-03d9-475e-9430-ac14b887b4ec_320X320.jpg?v=1550730832
Straight Cute Beautiful Attractive Green Bay Packers Leggings,//cdn.shopify.com/s/files/1/1635/1491/products/7eb081ab-74f1-41d0-a17b-a1c32d80119b_320X320.jpg?v=1550730814
Straight Cute Beautiful Attractive Detroit Lions Leggings,//cdn.shopify.com/s/files/1/1635/1491/products/e276e09a-1b69-411b-a913-29df430f9bb0_320X320.jpg?v=1550730796
Straight Cute Beautiful Attractive Denver Broncos Leggings,//cdn.shopify.com/s/files/1/1635/1491/products/8d6c1faa-8b82-4b7f-9c54-c8102683cbfc_320X320.jpg?v=1550730776
Straight Cute Beautiful Attractive Cleveland Browns Leggings,//cdn.shopify.com/s/files/1/1635/1491/products/ac89ae77-c912-499b-a286-3c8ae5414e7e_320X320.jpg?v=1550728124
Straight Cute Beautiful Attractive Cincinnati Bengals Leggings,//cdn.shopify.com/s/files/1/1635/1491/products/9fe02ee8-9fd7-460c-801a-c514a3a1b9bd_320X320.jpg?v=1550728105
Straight Cute Beautiful Attractive Chicago Bears Leggings,//cdn.shopify.com/s/files/1/1635/1491/products/aaa7bc65-9012-4db6-849f-53f88be3fe5c_320X320.jpg?v=1550728084
Straight Cute Beautiful Attractive Carolina Panthers Leggings,//cdn.shopify.com/s/files/1/1635/1491/products/b383f985-b0d6-4f4b-8a4e-e47263317a57_320X320.jpg?v=1550728061
Straight Cute Beautiful Attractive Baltimore Ravens Leggings,//cdn.shopify.com/s/files/1/1635/1491/products/3f9f66a7-f66d-4999-a101-4e48dafe7def_320X320.jpg?v=1550728010
Straight Cute Beautiful Attractive Atlanta Falcons Leggings,//cdn.shopify.com/s/files/1/1635/1491/products/86a9c1b1-68c0-417e-9e50-853353d05bff_320X320.jpg?v=1550727985
Straight Cute Beautiful Attractive Arizona Cardinals Leggings,//cdn.shopify.com/s/files/1/1635/1491/products/419f1f4a-f9db-4438-bad6-b00b62182be0_320X320.jpg?v=1550727961
Cool Air Lighten Attractive Kind Winnipeg Jets Leggings,//cdn.shopify.com/s/files/1/1635/1491/products/Winnipeg_Jets_b18cf72d-2ae3-4d9f-ac37-70eb83bc7ac4_320X320.jpg?v=1550733409
Cool Air Lighten Attractive Kind Washington Capitals Leggings,//cdn.shopify.com/s/files/1/1635/1491/products/Washington_Capitals_584ba5b7-afcf-4ca6-94da-09f6ec5daa32_320X320.jpg?v=1550733406
Cool Air Lighten Attractive Kind Vegas Golden Knights Leggings,//cdn.shopify.com/s/files/1/1635/1491/products/Vegas_Golden_Knights_75c3f1a3-b8ae-4d7f-a2e9-4c055ee932da_320X320.jpg?v=1550733403
Cool Air Lighten Attractive Kind Vancouver Canucks Leggings,//cdn.shopify.com/s/files/1/1635/1491/products/Vancouver_Canucks_8913862f-6976-4986-84e1-41fefe038d52_320X320.jpg?v=1550733397
Cool Air Lighten Attractive Kind Toronto Maple Leafs Leggings,//cdn.shopify.com/s/files/1/1635/1491/products/Toronto_Maple_Leafs_b2a53ef6-aea5-4459-b990-ff8eb3c7eaaa_320X320.jpg?v=1550733393
Cool Air Lighten Attractive Kind Tampa Bay Lightning Leggings,//cdn.shopify.com/s/files/1/1635/1491/products/Tampa_Bay_Lightning_c8f85fda-9fea-4da6-8077-0e2415460b15_320X320.jpg?v=1550733391
Cool Air Lighten Attractive Kind St. Louis Blues Leggings,//cdn.shopify.com/s/files/1/1635/1491/products/St_Louis_Blues_f218082d-1f39-4cd2-a04c-6b176151a1b4_320X320.jpg?v=1550733388
Cool Air Lighten Attractive Kind San Jose Sharks Leggings,//cdn.shopify.com/s/files/1/1635/1491/products/San_Jose_Sharks_9ac1c3b5-b7ec-4570-9ad9-a3efa079cafd_320X320.jpg?v=1550733384
Cool Air Lighten Attractive Kind Pittsburgh Penguins Leggings,//cdn.shopify.com/s/files/1/1635/1491/products/Pittsburgh_Penguins_f37bf1c3-aee9-49d9-b18e-9423c75d48a2_320X320.jpg?v=1550733381
Cool Air Lighten Attractive Kind Philadelphia Flyers Leggings,//cdn.shopify.com/s/files/1/1635/1491/products/Philadelphia_Flyers_8b9b6f1b-868f-458f-bdbe-4b105055fda8_320X320.jpg?v=1550733375
Cool Air Lighten Attractive Kind Ottawa Senators Leggings,//cdn.shopify.com/s/files/1/1635/1491/products/Ottawa_Senators_71776547-945e-4d90-9660-89224e85450d_320X320.jpg?v=1550733372
Cool Air Lighten Attractive Kind New York Rangers Leggings,//cdn.shopify.com/s/files/1/1635/1491/products/New_York_Rangers_32cb8b63-5186-44d4-a2f6-d05fdd7f532c_320X320.jpg?v=1550733368
Cool Air Lighten Attractive Kind New York Islanders Leggings,//cdn.shopify.com/s/files/1/1635/1491/products/New_York_Islanders_6f5bbaa5-f98b-4d8e-bcfd-1fe83572eb40_320X320.jpg?v=1550733365
Cool Air Lighten Attractive Kind New Jersey Devils Leggings,//cdn.shopify.com/s/files/1/1635/1491/products/New_Jersey_Devils_06fc5097-279b-478f-ab7e-8af1b5929d33_320X320.jpg?v=1550733360
Cool Air Lighten Attractive Kind Nashville Predators Leggings,//cdn.shopify.com/s/files/1/1635/1491/products/Nashville_Predators_9888d0d1-9908-4006-b8a7-2a572f70a705_320X320.jpg?v=1550733357
Cool Air Lighten Attractive Kind Montreal Canadiens Leggings,//cdn.shopify.com/s/files/1/1635/1491/products/Montreal_Canadiens_c40014c2-6bd7-4aa4-b27a-02dd16b19b9b_320X320.jpg?v=1550733353
Cool Air Lighten Attractive Kind Minnesota Wild Leggings,//cdn.shopify.com/s/files/1/1635/1491/products/Minnesota_Wild_169febac-8836-42a4-b3d3-0e61bfd94dc1_320X320.jpg?v=1550733348
Cool Air Lighten Attractive Kind Los Angeles Kings Leggings,//cdn.shopify.com/s/files/1/1635/1491/products/Los_Angeles_Kings_82043164-3166-4d5c-8ce3-d0df8fff3404_320X320.jpg?v=1550733344
Cool Air Lighten Attractive Kind Florida Panthers Leggings,//cdn.shopify.com/s/files/1/1635/1491/products/Florida_Panthers_8d600eab-05ce-460f-80b4-e66c027477c8_320X320.jpg?v=1550733340
Cool Air Lighten Attractive Kind Edmonton Oilers Leggings,//cdn.shopify.com/s/files/1/1635/1491/products/Edmonton_Oilers_f8b70109-808b-4c8c-87c5-5fab879c96b9_320X320.jpg?v=1550733337
Cool Air Lighten Attractive Kind Detroit Red Wings Leggings,//cdn.shopify.com/s/files/1/1635/1491/products/Detroit_Red_Wings_54534ac4-4424-4f49-a58f-f1b680064f1a_320X320.jpg?v=1550733333
Cool Air Lighten Attractive Kind Dallas Stars Leggings,//cdn.shopify.com/s/files/1/1635/1491/products/Dallas_Stars_8767977e-2197-4407-866b-c87db10d86f8_320X320.jpg?v=1550733328
Cool Air Lighten Attractive Kind Columbus Blue Jackets Leggings,//cdn.shopify.com/s/files/1/1635/1491/products/Columbus_Blue_Jackets_e9c812ad-ac21-4aee-add8-aa00fde48f4a_320X320.jpg?v=1550733325
Cool Air Lighten Attractive Kind Colorado Avalanche Leggings,//cdn.shopify.com/s/files/1/1635/1491/products/Colorado_Avalanche_4865fada-1ea1-4e43-800d-e6c2ea96f202_320X320.jpg?v=1550733321
Cool Air Lighten Attractive Kind Chicago Blackhawks Leggings,//cdn.shopify.com/s/files/1/1635/1491/products/Chicago_Blackhawks_b4117792-674e-4fad-9ed0-ac60ca185909_320X320.jpg?v=1550733318
Cool Air Lighten Attractive Kind Carolina Hurricanes Leggings,//cdn.shopify.com/s/files/1/1635/1491/products/Carolina_Hurricanes_6fc8d683-40f9-40e2-b35c-f34f9a09e72f_320X320.jpg?v=1550733311
Cool Air Lighten Attractive Kind Calgary Flames Leggings,//cdn.shopify.com/s/files/1/1635/1491/products/Calgary_Flames_5c8bca6f-4196-4cf1-9742-733328660eb0_320X320.jpg?v=1550733308
Cool Air Lighten Attractive Kind Buffalo Sabres Leggings,//cdn.shopify.com/s/files/1/1635/1491/products/Buffalo_Sabres_8ecbf8da-3ea5-4338-aee2-5d656899abd3_320X320.jpg?v=1550733304
Cool Air Lighten Attractive Kind Boston Bruins Leggings,//cdn.shopify.com/s/files/1/1635/1491/products/Boston_Bruins_bbb1ea1b-821e-43e2-8c57-8c04a5d04f97_320X320.jpg?v=1550733302
Cool Air Lighten Attractive Kind Arizona Coyotes Leggings,//cdn.shopify.com/s/files/1/1635/1491/products/Arizona_Coyotes_9f411853-7763-452a-b1bd-4209cc396481_320X320.jpg?v=1550733299
Cool Air Lighten Attractive Kind Anaheim Ducks Leggings,//cdn.shopify.com/s/files/1/1635/1491/products/Anaheim_Ducks_7d4d5a3b-6f15-47ed-958b-051ff6c9e2f2_320X320.jpg?v=1550733295
Cool Air Lighten Attractive Kind Washington Redskins Leggings,//cdn.shopify.com/s/files/1/1635/1491/products/Washington_Redskins_c33cbce2-eb91-4efa-aaf0-887e6449bde4_320X320.jpg?v=1550725005
Cool Air Lighten Attractive Kind Tennessee Titans Leggings,//cdn.shopify.com/s/files/1/1635/1491/products/Tennessee_Titans_ae88fa8b-4bb4-46b2-97e0-2ba4f644c2c9_320X320.jpg?v=1550725001
Cool Air Lighten Attractive Kind Tampa Bay Buccaneers Leggings,//cdn.shopify.com/s/files/1/1635/1491/products/Tampa_Bay_Buccaneers_a52bb30d-df47-4f82-83b9-cb9087cc5086_320X320.jpg?v=1550724998
Cool Air Lighten Attractive Kind Seattle Seahawks Leggings,//cdn.shopify.com/s/files/1/1635/1491/products/Seattle_Seahawks_7a83dd15-2f0a-4cd6-9c8a-c3a9c374ba02_320X320.jpg?v=1550724994
Cool Air Lighten Attractive Kind San Francisco 49ers Leggings,//cdn.shopify.com/s/files/1/1635/1491/products/San_Francisco_49ers_f5e5a407-2214-4989-9351-8786345acf21_320X320.jpg?v=1550724991
Cool Air Lighten Attractive Kind Pittsburgh Steelers Leggings,//cdn.shopify.com/s/files/1/1635/1491/products/Pittsburgh_Steelers_9b9b388e-7421-4c91-99ac-648baa224f3f_320X320.jpg?v=1550724984
Cool Air Lighten Attractive Kind Philadelphia Eagles Leggings,//cdn.shopify.com/s/files/1/1635/1491/products/Philadelphia_Eagles_142a1f30-e898-4301-a0a9-212dc6816e1f_320X320.jpg?v=1550724981
Cool Air Lighten Attractive Kind Oakland Raiders Leggings,//cdn.shopify.com/s/files/1/1635/1491/products/Oakland_Raiders_2ac2bf91-df95-4857-8fe6-4d64c63c7ae9_320X320.jpg?v=1550724976
Cool Air Lighten Attractive Kind New York Jets Leggings,//cdn.shopify.com/s/files/1/1635/1491/products/New_York_Jets_7bc33b02-0589-416b-8586-88b0164d4c7c_320X320.jpg?v=1550724972
Cool Air Lighten Attractive Kind New York Giants Leggings,//cdn.shopify.com/s/files/1/1635/1491/products/New_York_Giants_07afca7f-334b-448e-846a-d312f0811ffb_320X320.jpg?v=1550724967
Cool Air Lighten Attractive Kind New Orleans Saints Leggings,//cdn.shopify.com/s/files/1/1635/1491/products/New_Orleans_Saints_651cebf8-6b9d-4f62-85db-ba389bf23c10_320X320.jpg?v=1550724964
Cool Air Lighten Attractive Kind New England Patriots Leggings,//cdn.shopify.com/s/files/1/1635/1491/products/New_England_Patriots_647685d7-ff03-48f7-b538-b64aa0fded43_320X320.jpg?v=1550724957
Cool Air Lighten Attractive Kind Minnesota Vikings Leggings,//cdn.shopify.com/s/files/1/1635/1491/products/Minnesota_Vikings_086cb6b2-6b9f-4e7c-9e7b-b01c7dd52ac9_320X320.jpg?v=1550724954
Cool Air Lighten Attractive Kind Miami Dolphins Leggings,//cdn.shopify.com/s/files/1/1635/1491/products/Miami_Dolphins_e5e78fc1-faca-49d2-b0d4-ed3860dcd71d_320X320.jpg?v=1550724950
Cool Air Lighten Attractive Kind Los Angeles Rams Leggings,//cdn.shopify.com/s/files/1/1635/1491/products/Los_Angeles_Rams_f9b31c3d-295c-4d5d-957b-e7097b77e38f_320X320.jpg?v=1550724946
Cool Air Lighten Attractive Kind Los Angeles Chargers Leggings,//cdn.shopify.com/s/files/1/1635/1491/products/Los_Angeles_Chargers_b3c20e15-2661-4500-a327-ca5ea6565f69_320X320.jpg?v=1550724940
Cool Air Lighten Attractive Kind Kansas City Chiefs Leggings,//cdn.shopify.com/s/files/1/1635/1491/products/Kansas_City_Chiefs_28ed0ab2-25da-459e-a2bc-8287c848c31e_320X320.jpg?v=1550724935
Cool Air Lighten Attractive Kind Jacksonville Jaguars Leggings,//cdn.shopify.com/s/files/1/1635/1491/products/Jacksonville_Jaguars_811d33f0-fe86-4572-8698-b5dad4d7d150_320X320.jpg?v=1550724932
Cool Air Lighten Attractive Kind Indianapolis Colts Leggings,//cdn.shopify.com/s/files/1/1635/1491/products/Indianapolis_Colts_370a3641-c3ed-4c4c-8fc5-a14676fa4eb2_320X320.jpg?v=1550724929
Cool Air Lighten Attractive Kind Houston Texans Leggings,//cdn.shopify.com/s/files/1/1635/1491/products/HOUSTON_TEXANS_9a557e6a-67a3-4db9-ad4c-cc11cbe974db_320X320.jpg?v=1550724926
Cool Air Lighten Attractive Kind Green Bay Packers Leggings,//cdn.shopify.com/s/files/1/1635/1491/products/Green_Bay_Packers_f2c34d82-4dce-4827-a104-687e4838fbab_320X320.jpg?v=1550724922
Cool Air Lighten Attractive Kind Detroit Lions Leggings,//cdn.shopify.com/s/files/1/1635/1491/products/Detroit_Lions_6e450f70-8d90-4d86-8990-bea5e819bbdf_320X320.jpg?v=1550724916
Cool Air Lighten Attractive Kind Denver Broncos Leggings,//cdn.shopify.com/s/files/1/1635/1491/products/Denver_Broncos_ae435db8-562d-4bad-bccc-74bf270f5f59_320X320.jpg?v=1550724913
Cool Air Lighten Attractive Kind Cleveland Browns Leggings,//cdn.shopify.com/s/files/1/1635/1491/products/Cleveland_Browns_079bc708-924e-4dcc-a534-e0fcba016cb2_320X320.jpg?v=1550724909
