name,image
Cool Air Lighten Attractive Kind Cincinnati Bengals Leggings,//cdn.shopify.com/s/files/1/1635/1491/products/Cincinnati_Bengals_0951b82e-d966-465d-9ac0-84d77def4522_320X320.jpg?v=1550724903
Cool Air Lighten Attractive Kind Chicago Bears Leggings,//cdn.shopify.com/s/files/1/1635/1491/products/Chicago_Bears_77dd1c82-2eef-40c4-946b-71496af8e725_320X320.jpg?v=1550724899
Cool Air Lighten Attractive Kind Carolina Panthers Leggings,//cdn.shopify.com/s/files/1/1635/1491/products/Carolina_Panthers_c0a33343-439e-4255-9345-f36cc6c2549f_320X320.jpg?v=1550724895
Cool Air Lighten Attractive Kind Buffalo Bills Leggings,//cdn.shopify.com/s/files/1/1635/1491/products/Buffalo_Bills_086a8f37-7467-4a51-bc4d-d4a0efde4c75_320X320.jpg?v=1550724891
Cool Air Lighten Attractive Kind Baltimore Ravens Leggings,//cdn.shopify.com/s/files/1/1635/1491/products/Baltimore_Ravens_ecfee170-2772-4418-9dde-d378454bd808_320X320.jpg?v=1550724889
Cool Air Lighten Attractive Kind Atlanta Falcons Leggings,//cdn.shopify.com/s/files/1/1635/1491/products/Atlanta_Falcons_0eddffc4-edf4-417f-9bf2-33deb8308131_320X320.jpg?v=1550724885
Cool Air Lighten Attractive Kind Arizona Cardinals Leggings,//cdn.shopify.com/s/files/1/1635/1491/products/Arizona_Cardinals_eccdd6b9-28f7-40ac-85ac-0eda78802af8_320X320.jpg?v=1550724877
Cool Air Lighten Attractive Kind UCLA Bruins Leggings,//cdn.shopify.com/s/files/1/1635/1491/products/UCLA_Bruins_82990184-b0af-4e1b-b842-2ae1f82ba9d2_320X320.jpg?v=1550722724
Cool Air Lighten Attractive Kind Texas Longhorns Leggings,//cdn.shopify.com/s/files/1/1635/1491/products/Texas_Longhorns_be4a2105-5878-4afb-896d-6dea15d5cf42_320X320.jpg?v=1550722720
Cool Air Lighten Attractive Kind Tennessee Volunteers Leggings,//cdn.shopify.com/s/files/1/1635/1491/products/Tennessee_Volunteers_293578f4-1d36-4375-b263-d1fd0589ac93_320X320.jpg?v=1550722717
Cool Air Lighten Attractive Kind South Florida Bulls Leggings,//cdn.shopify.com/s/files/1/1635/1491/products/South_Florida_Bulls_89a834cf-ea65-4a29-928d-8980b4c3f0bf_320X320.jpg?v=1550722714
Cool Air Lighten Attractive Kind SMU Mustangs Leggings,//cdn.shopify.com/s/files/1/1635/1491/products/SMU_Mustangs_b34b543f-82ff-4d75-bfb4-fa0de82360ae_320X320.jpg?v=1550722709
Cool Air Lighten Attractive Kind Oklahoma Sooners Leggings,//cdn.shopify.com/s/files/1/1635/1491/products/Oklahoma_Sooners_59ce850a-d4de-4a4c-bf06-e41ed5d72ed8_320X320.jpg?v=1550722707
Cool Air Lighten Attractive Kind Ohio State Buckeyes Leggings,//cdn.shopify.com/s/files/1/1635/1491/products/Ohio_State_Buckeyes_7a0b71c8-9e1f-4eb5-af36-5b81fc9219a2_320X320.jpg?v=1550722702
Cool Air Lighten Attractive Kind Northern Illinois Huskies Leggings,//cdn.shopify.com/s/files/1/1635/1491/products/Northern_Illinois_Huskies_13b7b3d7-ded4-4be1-ad49-39aaa16340b5_320X320.jpg?v=1550722698
Cool Air Lighten Attractive Kind Navy Midshipmen Leggings,//cdn.shopify.com/s/files/1/1635/1491/products/Navy_Midshipmen_fdc33ce8-2e2b-494d-9670-17a654330687_320X320.jpg?v=1550722695
Cool Air Lighten Attractive Kind Miami RedHawks Leggings,//cdn.shopify.com/s/files/1/1635/1491/products/Miami_RedHawks_242b4585-2c7a-42fb-bb40-5b4b05377dbb_320X320.jpg?v=1550722692
Cool Air Lighten Attractive Kind Memphis Tigers Leggings,//cdn.shopify.com/s/files/1/1635/1491/products/Memphis_Tigers_a0ef93e5-3621-4c85-96d3-ff5f0fce8266_320X320.jpg?v=1550722689
Cool Air Lighten Attractive Kind Marshall Thundering Herd Leggings,//cdn.shopify.com/s/files/1/1635/1491/products/Marshall_Thundering_Herd_28624de5-9357-49c3-906b-0da3cd3e8605_320X320.jpg?v=1550722682
Cool Air Lighten Attractive Kind LSU Tigers Leggings,//cdn.shopify.com/s/files/1/1635/1491/products/LSU_Tigers_b16fa3b5-4da3-4a85-83e9-e9d61ad415ef_320X320.jpg?v=1550722679
Cool Air Lighten Attractive Kind Louisville Cardinals Leggings,//cdn.shopify.com/s/files/1/1635/1491/products/Louisville_Cardinals_08da41e9-195e-465d-96c7-9de18d957f4a_320X320.jpg?v=1550722675
Cool Air Lighten Attractive Kind Kent State Golden Flashes Leggings,//cdn.shopify.com/s/files/1/1635/1491/products/Kent_State_Golden_Flashes_b75c3f47-68b9-4809-8a1b-7a8164538f27_320X320.jpg?v=1550722672
Cool Air Lighten Attractive Kind Houston Cougars Leggings,//cdn.shopify.com/s/files/1/1635/1491/products/Houston_Cougars_f178bdf4-bdfb-4aaf-adf7-699af2c237be_320X320.jpg?v=1550722669
Cool Air Lighten Attractive Kind Hawaii Rainbow Warriors Leggings,//cdn.shopify.com/s/files/1/1635/1491/products/Hawaii_Rainbow_Warriors_11698e82-c73e-4383-8186-981bd5dcbacb_320X320.jpg?v=1550722665
Cool Air Lighten Attractive Kind Eastern Michigan Eagles Leggings,//cdn.shopify.com/s/files/1/1635/1491/products/GroupEastern_Michigan_Eagles_320X320.jpg?v=1550720561
Cool Air Lighten Attractive Kind Georgia Tech Yellow Jackets Leggings,//cdn.shopify.com/s/files/1/1635/1491/products/Georgia_Tech_Yellow_Jackets_a87defd2-ec41-4ff9-8f6f-b38cbe81977c_320X320.jpg?v=1550720570
Cool Air Lighten Attractive Kind Fresno State Bulldogs Leggings,//cdn.shopify.com/s/files/1/1635/1491/products/Fresno_State_Bulldogs_a5c234a2-47dd-4926-841c-17536c2c45ca_320X320.jpg?v=1550720567
Cool Air Lighten Attractive Kind Florida State Seminoles Leggings,//cdn.shopify.com/s/files/1/1635/1491/products/Florida_State_Seminoles_1728fbe9-6df9-4d0c-bd4b-8762d6d71b85_320X320.jpg?v=1550720552
Cool Air Lighten Attractive Kind East Carolina Pirates Leggings,//cdn.shopify.com/s/files/1/1635/1491/products/East_Carolina_Pirates_0c28e6b7-979f-443e-abc6-35b57208124a_320X320.jpg?v=1550720545
Cool Air Lighten Attractive Kind Connecticut Huskies Leggings,//cdn.shopify.com/s/files/1/1635/1491/products/Connecticut_Huskies_cb77b6d3-6ece-4c0d-9daa-533f6b1add64_320X320.jpg?v=1550720542
Cool Air Lighten Attractive Kind Cincinnati Bearcats Leggings,//cdn.shopify.com/s/files/1/1635/1491/products/Cincinnati_Bearcats_e4f5a5d9-4bca-4f7f-ae1c-b2d3585c408c_320X320.jpg?v=1550720538
Cool Air Lighten Attractive Kind Central Michigan Chippewas Leggings,//cdn.shopify.com/s/files/1/1635/1491/products/Central_Michigan_Chippewas_e7ee7c4d-d072-4838-acb4-799edf7d02da_320X320.jpg?v=1550720535
Cool Air Lighten Attractive Kind Buffalo Bulls Leggings,//cdn.shopify.com/s/files/1/1635/1491/products/Buffalo_Bulls_419fb3f7-7df5-40d5-acb9-704a97216831_320X320.jpg?v=1550720530
Cool Air Lighten Attractive Kind Bowling Green Falcons Leggings,//cdn.shopify.com/s/files/1/1635/1491/products/Bowling_Green_Falcons_ae43610e-0c2b-4442-8731-bcb5385a3e90_320X320.jpg?v=1550720527
Cool Air Lighten Attractive Kind Arkansas Razorbacks Leggings,//cdn.shopify.com/s/files/1/1635/1491/products/Arkansas_Razorbacks_c2b24a43-e00a-43bd-a8d5-2b96c32fe598_320X320.jpg?v=1550720518
Cool Air Lighten Attractive Kind Ball State Cardinals Leggings,//cdn.shopify.com/s/files/1/1635/1491/products/Ball_State_Cardinals_e58c2d05-c28b-4a01-8bc5-b48451f9c642_320X320.jpg?v=1550720521
Cool Air Lighten Attractive Kind Arizona Wildcats Leggings,//cdn.shopify.com/s/files/1/1635/1491/products/Arizona_Wildcats_620be7b1-4de0-40a4-8724-85d848ba1f72_320X320.jpg?v=1550720515
Cool Air Lighten Attractive Kind Arizona State Sun Devils Leggings,//cdn.shopify.com/s/files/1/1635/1491/products/Arizona_State_Sun_Devils_7366d8ab-9034-4c51-9852-0198fa6ce280_320X320.jpg?v=1550720512
Cool Air Lighten Attractive Kind Alabama Crimson Tide Leggings,//cdn.shopify.com/s/files/1/1635/1491/products/Alabama_Crimson_Tide_3267ba41-c72b-4d2a-9aeb-65c4faf7a740_320X320.jpg?v=1550720508
Cool Air Lighten Attractive Kind Akron Zips Leggings,//cdn.shopify.com/s/files/1/1635/1491/products/Akron_Zips_631a19f0-03c4-4437-a981-32069b5ab525_320X320.jpg?v=1550720506
Cool Air Lighten Attractive Kind Washington Nationals Leggings,//cdn.shopify.com/s/files/1/1635/1491/products/Washington_Nationals_554e65e3-6e42-4bb0-96f1-00fb71004a5a_320X320.jpg?v=1550718674
Cool Air Lighten Attractive Kind Toronto Blue Jays Leggings,//cdn.shopify.com/s/files/1/1635/1491/products/Toronto_Blue_Jays_d4fc6848-308b-4ab3-a00c-5856a3912369_320X320.jpg?v=1550718670
Cool Air Lighten Attractive Kind Texas Rangers Leggings,//cdn.shopify.com/s/files/1/1635/1491/products/Texas_Rangers_7c8847d7-5088-4a9f-834d-69639b140596_320X320.jpg?v=1550718667
Cool Air Lighten Attractive Kind Tampa Bay Rays Leggings,//cdn.shopify.com/s/files/1/1635/1491/products/Tampa_Bay_Rays_123ac2f8-b5dc-47de-b8a1-277ca75f9f9b_320X320.jpg?v=1550718662
Cool Air Lighten Attractive Kind St. Louis Cardinals Leggings,//cdn.shopify.com/s/files/1/1635/1491/products/St_Louis_Cardinals_b82f69fa-3870-4fc2-98f1-44949620f337_320X320.jpg?v=1550718659
Cool Air Lighten Attractive Kind Seattle Mariners Leggings,//cdn.shopify.com/s/files/1/1635/1491/products/Seattle_Mariners_4c1342f8-e93a-4568-96c0-7193c6093328_320X320.jpg?v=1550718655
Cool Air Lighten Attractive Kind San Francisco Giants Leggings,//cdn.shopify.com/s/files/1/1635/1491/products/San_Francisco_Giants_cd3be845-17d7-4a17-88ab-23d93c7f69eb_320X320.jpg?v=1550718650
Cool Air Lighten Attractive Kind San Diego Padres Leggings,//cdn.shopify.com/s/files/1/1635/1491/products/San_Diego_Padres_5d94bea5-380c-4ecb-9626-932e286ae692_320X320.jpg?v=1550718646
Cool Air Lighten Attractive Kind Pittsburgh Pirates Leggings,//cdn.shopify.com/s/files/1/1635/1491/products/Pittsburgh_Pirates_49f14b71-a88f-4510-ab5d-30967235f776_320X320.jpg?v=1550718643
Cool Air Lighten Attractive Kind Philadelphia Phillies Leggings,//cdn.shopify.com/s/files/1/1635/1491/products/Philadelphia_Phillies_1911705d-a904-43da-8135-b3a4b9addcfd_320X320.jpg?v=1550718639
Cool Air Lighten Attractive Kind New York Yankees Leggings,//cdn.shopify.com/s/files/1/1635/1491/products/New_York_Yankees_db14ccbf-09b7-4683-8dce-2c6ef76cb6e0_320X320.jpg?v=1550718631
Cool Air Lighten Attractive Kind New York Mets Leggings,//cdn.shopify.com/s/files/1/1635/1491/products/New_York_Mets_9af30994-dd63-40ab-b57b-f50554958afb_320X320.jpg?v=1550718626
Cool Air Lighten Attractive Kind Minnesota Twins Leggings,//cdn.shopify.com/s/files/1/1635/1491/products/Minnesota_Twins_b4dffe0f-047c-4831-a7ab-f328954c96be_320X320.jpg?v=1550718620
Cool Air Lighten Attractive Kind Milwaukee Brewers Leggings,//cdn.shopify.com/s/files/1/1635/1491/products/Milwaukee_Brewers_b653e0c0-aa72-42e1-a942-44d10d9be437_320X320.jpg?v=1550718617
Cool Air Lighten Attractive Kind Miami Marlins Leggings,//cdn.shopify.com/s/files/1/1635/1491/products/Miami_Marlins_53b153e5-929a-4d62-b207-d46b4bac35aa_320X320.jpg?v=1550718613
Cool Air Lighten Attractive Kind Los Angeles Dodgers Leggings,//cdn.shopify.com/s/files/1/1635/1491/products/Los_Angeles_Dodgers_c58fc80b-77ff-440b-a729-b053d6a27ff4_320X320.jpg?v=1550718609
Cool Air Lighten Attractive Kind Los Angeles Angels Leggings,//cdn.shopify.com/s/files/1/1635/1491/products/Los_Angeles_Angels_866d6d8c-3d71-4530-b4d1-bd5083b668da_320X320.jpg?v=1550718606
Cool Air Lighten Attractive Kind Kansas City Royals Leggings,//cdn.shopify.com/s/files/1/1635/1491/products/Kansas_City_Royals_ad8f7876-ff29-41ff-a1d4-76a086bb2e02_320X320.jpg?v=1550718602
Cool Air Lighten Attractive Kind Houston Astros Leggings,//cdn.shopify.com/s/files/1/1635/1491/products/Houston_Astros_303253ac-46d4-4570-9146-011b43cb5dc0_320X320.jpg?v=1550718599
Cool Air Lighten Attractive Kind Detroit Tigers Leggings,//cdn.shopify.com/s/files/1/1635/1491/products/Detroit_Tigers_52164884-6938-45ed-b0f2-4567ada8ff6e_320X320.jpg?v=1550718596
Cool Air Lighten Attractive Kind Colorado Rockies Leggings,//cdn.shopify.com/s/files/1/1635/1491/products/Colorado_Rockies_a68e50fc-e67b-43ae-ba67-21d88a006842_320X320.jpg?v=1550718592
Cool Air Lighten Attractive Kind Cleveland Indians Leggings,//cdn.shopify.com/s/files/1/1635/1491/products/Cleveland_Indians_fbbf8019-7619-4b99-8d84-d58574521069_320X320.jpg?v=1550718587
Cool Air Lighten Attractive Kind Cincinnati Reds Leggings,//cdn.shopify.com/s/files/1/1635/1491/products/Cincinnati_Reds_683762ce-fc99-4194-9546-cbf9da897b7a_320X320.jpg?v=1550718584
Cool Air Lighten Attractive Kind Chicago White Sox Leggings,//cdn.shopify.com/s/files/1/1635/1491/products/Chicago_White_Sox_da03a846-7fba-41c1-bbc1-3e31f100478c_320X320.jpg?v=1550718580
Cool Air Lighten Attractive Kind Chicago Cubs Leggings,//cdn.shopify.com/s/files/1/1635/1491/products/Chicago_Cubs_20a469ae-56cd-4b0c-b8be-7c34a7f7b18d_320X320.jpg?v=1550718574
Cool Air Lighten Attractive Kind Baltimore Orioles Leggings,//cdn.shopify.com/s/files/1/1635/1491/products/Baltimore_Oriole_320X320.jpg?v=1550718552
Cool Air Lighten Attractive Kind Atlanta Braves Leggings,//cdn.shopify.com/s/files/1/1635/1491/products/Baltimore_Ravens_bdf0253e-9abc-41dd-9a6e-ecf5bac35aea_320X320.jpg?v=1550718679
Cool Air Lighten Attractive Kind Arizona Diamondbacks Leggings,//cdn.shopify.com/s/files/1/1635/1491/products/Arizona_Cardinals_12c4e5df-b5f6-4f48-8db0-8877ecf5a140_320X320.jpg?v=1550718529
Straight Cute Beautiful Attractive Winnipeg Jets Leggings,//cdn.shopify.com/s/files/1/1635/1491/products/Winnipeg_Jets_3cc67b3c-47c2-4c94-bdbd-6a1e66aff880_320X320.jpg?v=1550715572
Straight Cute Beautiful Attractive Washington Capitals Leggings,//cdn.shopify.com/s/files/1/1635/1491/products/Washington_Capitals_f5dde4f6-ce07-4e74-b0f0-bf8862d128dd_320X320.jpg?v=1550715984
Straight Cute Beautiful Attractive Vancouver Canucks Leggings,//cdn.shopify.com/s/files/1/1635/1491/products/Vancouver_Canucks_4d6fc253-30e2-4207-9560-2f086eab8c3b_320X320.jpg?v=1550715976
Straight Cute Beautiful Attractive Tampa Bay Lightning Leggings,//cdn.shopify.com/s/files/1/1635/1491/products/Tampa_Bay_Lightning_26792dbf-aadd-4b75-926a-8bbb0fad0c40_320X320.jpg?v=1550715966
Straight Cute Beautiful Attractive St. Louis Blues Leggings,//cdn.shopify.com/s/files/1/1635/1491/products/St_Louis_Blues_77037c97-cc87-43fb-9d13-ff0af75f7685_320X320.jpg?v=1550715961
Straight Cute Beautiful Attractive San Jose Sharks Leggings,//cdn.shopify.com/s/files/1/1635/1491/products/San_Jose_Sharks_1040465e-b915-499e-a7c2-f9ff01d44530_320X320.jpg?v=1550715957
Straight Cute Beautiful Attractive Pittsburgh Penguins Leggings,//cdn.shopify.com/s/files/1/1635/1491/products/Pittsburgh_Penguins_ca5a7319-52c5-4eae-bb90-9f647f2ebf52_320X320.jpg?v=1550715953
Straight Cute Beautiful Attractive Philadelphia Flyers Leggings,//cdn.shopify.com/s/files/1/1635/1491/products/Philadelphia_Flyers_53ea3c10-e5d9-404b-a51f-3391f9f1465d_320X320.jpg?v=1550715948
Straight Cute Beautiful Attractive Ottawa Senators Leggings,//cdn.shopify.com/s/files/1/1635/1491/products/Ottawa_Senators_c30709cd-84aa-46db-822d-c51d0983b9d3_320X320.jpg?v=1550715575
Straight Cute Beautiful Attractive New York Rangers Leggings,//cdn.shopify.com/s/files/1/1635/1491/products/New_York_Rangers_50fe57b9-0515-46bb-b0fd-a75b3097ce84_320X320.jpg?v=1550715442
Straight Cute Beautiful Attractive New York Islanders Leggings,//cdn.shopify.com/s/files/1/1635/1491/products/New_York_Islanders_d0dd3527-6164-4063-b173-539cf6206e93_320X320.jpg?v=1550715437
Straight Cute Beautiful Attractive New Jersey Devils Leggings,//cdn.shopify.com/s/files/1/1635/1491/products/New_Jersey_Devils_240dd62f-7cb3-4127-b4e0-012cbe3c526a_320X320.jpg?v=1550715419
Straight Cute Beautiful Attractive Nashville Predators Leggings,//cdn.shopify.com/s/files/1/1635/1491/products/Nashville_Predators_207422c3-6474-4b0f-8562-d1f27f2103c8_320X320.jpg?v=1550715413
Straight Cute Beautiful Attractive Montreal Canadiens Leggings,//cdn.shopify.com/s/files/1/1635/1491/products/Montreal_Canadiens_e0138514-ed56-487e-a3af-ccbe556661e1_320X320.jpg?v=1550715409
Straight Cute Beautiful Attractive Minnesota Wild Leggings,//cdn.shopify.com/s/files/1/1635/1491/products/Minnesota_Wild_6c97409f-6a2a-4761-bc98-cec20caed1c4_320X320.jpg?v=1550715405
Straight Cute Beautiful Attractive Los Angeles Kings Leggings,//cdn.shopify.com/s/files/1/1635/1491/products/Los_Angeles_Kings_689795da-8b74-47a8-884e-7bc9cef64f49_320X320.jpg?v=1550715399
Straight Cute Beautiful Attractive Florida Panthers Leggings,//cdn.shopify.com/s/files/1/1635/1491/products/Florida_Panthers_d4a35b1d-db38-4ce0-9a8c-2f73605b5505_320X320.jpg?v=1550715396
Straight Cute Beautiful Attractive Edmonton Oilers Leggings,//cdn.shopify.com/s/files/1/1635/1491/products/Edmonton_Oilers_916be620-e8be-4961-a391-ee2b0dfcd748_320X320.jpg?v=1550715389
Straight Cute Beautiful Attractive Detroit Red Wings Leggings,//cdn.shopify.com/s/files/1/1635/1491/products/Detroit_Red_Wings_52b3c527-7c97-4762-84e1-61df669d9c28_320X320.jpg?v=1550715385
Straight Cute Beautiful Attractive Dallas Stars Leggings,//cdn.shopify.com/s/files/1/1635/1491/products/Dallas_Stars_73d1389a-b48c-4e2a-9c73-212dcd4f4c89_320X320.jpg?v=1550715379
Straight Cute Beautiful Attractive Colorado Avalanche Leggings,//cdn.shopify.com/s/files/1/1635/1491/products/Colorado_Avalanche_e1805d3d-645d-4ca5-a0fa-b96be2631e9c_320X320.jpg?v=1550715368
Straight Cute Beautiful Attractive Chicago Blackhawks Leggings,//cdn.shopify.com/s/files/1/1635/1491/products/Chicago_Blackhawks_579c056f-16e6-4b3c-bca2-269512934a7b_320X320.jpg?v=1550715365
Straight Cute Beautiful Attractive Carolina Hurricanes Leggings,//cdn.shopify.com/s/files/1/1635/1491/products/Carolina_Hurricanes_770f5f15-c29f-46da-9917-130b8f4ede74_320X320.jpg?v=1550715360
Straight Cute Beautiful Attractive Calgary Flames Leggings,//cdn.shopify.com/s/files/1/1635/1491/products/Calgary_Flames_fe28c241-7704-4191-bad4-36d4da56aad1_320X320.jpg?v=1550715359
Straight Cute Beautiful Attractive Buffalo Sabres Leggings,//cdn.shopify.com/s/files/1/1635/1491/products/Buffalo_Sabres_a4303753-392e-4ec0-bfa7-c933d4089895_320X320.jpg?v=1550715348
Straight Cute Beautiful Attractive Boston Bruins Leggings,//cdn.shopify.com/s/files/1/1635/1491/products/Boston_Bruins_6451f5e2-932f-40ad-8865-682cf35e79e7_320X320.jpg?v=1550715344
Straight Cute Beautiful Attractive Arizona Coyotes Leggings,//cdn.shopify.com/s/files/1/1635/1491/products/Arizona_Coyotes_1a5d8715-8f72-4dcf-ab36-676eb8c87b7d_320X320.jpg?v=1550715340
Straight Cute Beautiful Attractive Anaheim Ducks Leggings,//cdn.shopify.com/s/files/1/1635/1491/products/Anaheim_Ducks_73009681-f046-4386-b012-ab46a007bcf0_320X320.jpg?v=1550715336
Straight Cute Beautiful Attractive UCLA Bruins Leggings,//cdn.shopify.com/s/files/1/1635/1491/products/UCLA_Bruins_2270e87b-a1a5-46f8-9271-4b17990cd3df_320X320.jpg?v=1550659488
Straight Cute Beautiful Attractive Texas Longhorns Leggings,//cdn.shopify.com/s/files/1/1635/1491/products/Texas_Longhorns_5f3cb70e-4aae-41ce-b4ea-7a4c08f594b6_320X320.jpg?v=1550659484
Straight Cute Beautiful Attractive Tennessee Volunteers Leggings,//cdn.shopify.com/s/files/1/1635/1491/products/Tennessee_Volunteers_ab0e162f-d1c4-4142-8c1e-0289113f3808_320X320.jpg?v=1550659480
Straight Cute Beautiful Attractive South Florida Bulls Leggings,//cdn.shopify.com/s/files/1/1635/1491/products/South_Florida_Bulls_0486990e-0515-4193-9334-d648026330bb_320X320.jpg?v=1550659477
Straight Cute Beautiful Attractive SMU Mustangs Leggings,//cdn.shopify.com/s/files/1/1635/1491/products/SMU_Mustangs_e161f2ac-9ea8-4a06-a108-9167cf8f54d5_320X320.jpg?v=1550659473
Straight Cute Beautiful Attractive Oklahoma Sooners Leggings,//cdn.shopify.com/s/files/1/1635/1491/products/Oklahoma_Sooners_805452df-8276-4672-bae0-fc024da641e4_320X320.jpg?v=1550659470
Straight Cute Beautiful Attractive Ohio State Buckeyes Leggings,//cdn.shopify.com/s/files/1/1635/1491/products/Ohio_State_Buckeyes_f3896634-8add-4b8d-ad0e-4b8bf6985940_320X320.jpg?v=1550659466
Straight Cute Beautiful Attractive Northern Illinois Huskies Leggings,//cdn.shopify.com/s/files/1/1635/1491/products/Northern_Illinois_Huskies_d39b7ebe-d2da-4ed1-af1c-58e83f2f49a9_320X320.jpg?v=1550659457
Straight Cute Beautiful Attractive Navy Midshipmen Leggings,//cdn.shopify.com/s/files/1/1635/1491/products/Navy_Midshipmen_98df5de1-f347-4010-a954-46becd9c34a1_320X320.jpg?v=1550659454
Straight Cute Beautiful Attractive Miami RedHawks Leggings,//cdn.shopify.com/s/files/1/1635/1491/products/Miami_RedHawks_fb80d971-78dc-4c49-bae6-3ff8bb225bd3_320X320.jpg?v=1550659449
Straight Cute Beautiful Attractive Memphis Tigers Leggings,//cdn.shopify.com/s/files/1/1635/1491/products/Memphis_Tigers_ca0df0ec-0465-4017-b591-78aaefc93fcc_320X320.jpg?v=1550659444
Straight Cute Beautiful Attractive Marshall Thundering Herd Leggings,//cdn.shopify.com/s/files/1/1635/1491/products/Marshall_Thundering_Herd_0b91210e-38f3-4f1d-ad40-f2f4bd45dafc_320X320.jpg?v=1550659438
Straight Cute Beautiful Attractive LSU Tigers Leggings,//cdn.shopify.com/s/files/1/1635/1491/products/LSU_Tigers_d5da08f4-87de-4bdd-88d4-e89ee9683de3_320X320.jpg?v=1550659431
Straight Cute Beautiful Attractive Louisville Cardinals Leggings,//cdn.shopify.com/s/files/1/1635/1491/products/Louisville_Cardinals_6c8e0e0c-94df-482f-98ab-9a8a0fdefb5a_320X320.jpg?v=1550659426
Straight Cute Beautiful Attractive Kent State Golden Flashes Leggings,//cdn.shopify.com/s/files/1/1635/1491/products/Kent_State_Golden_Flashes_937a48e6-b6df-4b25-a424-b527ba4de9f6_320X320.jpg?v=1550659421
Straight Cute Beautiful Attractive Houston Cougars Leggings,//cdn.shopify.com/s/files/1/1635/1491/products/Houston_Cougars_d19b0ad8-7158-455e-94ca-b71774c74227_320X320.jpg?v=1550659416
Straight Cute Beautiful Attractive Hawaii Rainbow Warriors Leggings,//cdn.shopify.com/s/files/1/1635/1491/products/Hawaii_Rainbow_Warriors_57b777d9-6937-4fba-86f1-c7e7a1457d9b_320X320.jpg?v=1550659413
Straight Cute Beautiful Attractive Georgia Tech Yellow Jackets Leggings,//cdn.shopify.com/s/files/1/1635/1491/products/Georgia_Tech_Yellow_Jackets_96d43411-a359-421f-a6d7-b21de5fc3275_320X320.jpg?v=1550659406
Straight Cute Beautiful Attractive Fresno State Bulldogs Leggings,//cdn.shopify.com/s/files/1/1635/1491/products/Fresno_State_Bulldogs_14242ab9-e0dd-4ac6-8a00-db5e3d073aa9_320X320.jpg?v=1550659401
Straight Cute Beautiful Attractive Florida State Seminoles Leggings,//cdn.shopify.com/s/files/1/1635/1491/products/Florida_State_Seminoles_64c1e319-58b6-400d-bacf-669052a9a6ec_320X320.jpg?v=1550659397
Straight Cute Beautiful Attractive Eastern Michigan Eagles Leggings,//cdn.shopify.com/s/files/1/1635/1491/products/Eastern_Michigan_Eagles_0d070512-8ec3-487d-8363-0c5fb291c660_320X320.jpg?v=1550659394
Straight Cute Beautiful Attractive East Carolina Pirates Leggings,//cdn.shopify.com/s/files/1/1635/1491/products/East_Carolina_Pirates_2abe8258-75c0-4c5b-b9f9-2823591d6879_320X320.jpg?v=1550659389
Straight Cute Beautiful Attractive Connecticut Huskies Leggings,//cdn.shopify.com/s/files/1/1635/1491/products/Connecticut_Huskies_d70b6579-32be-4d95-bcb5-081f6355bfd1_320X320.jpg?v=1550659386
Straight Cute Beautiful Attractive Cincinnati Bearcats Leggings,//cdn.shopify.com/s/files/1/1635/1491/products/Cincinnati_Bearcats_d7c7113e-321e-442c-969f-b2991cadc172_320X320.jpg?v=1550659377
Straight Cute Beautiful Attractive Central Michigan Chippewas Leggings,//cdn.shopify.com/s/files/1/1635/1491/products/Central_Michigan_Chippewas_3cbc45fb-e643-4085-9833-8fb5bafa130a_320X320.jpg?v=1550659374
Straight Cute Beautiful Attractive Buffalo Bulls Leggings,//cdn.shopify.com/s/files/1/1635/1491/products/Buffalo_Bulls_cb076c7c-36c1-4dc2-82f0-110f69f1553f_320X320.jpg?v=1550659370
Straight Cute Beautiful Attractive Bowling Green Falcons Leggings,//cdn.shopify.com/s/files/1/1635/1491/products/Bowling_Green_Falcons_d12e5bbf-8035-4dc3-8907-cdf7544db9e0_320X320.jpg?v=1550659366
Straight Cute Beautiful Attractive Ball State Cardinals Leggings,//cdn.shopify.com/s/files/1/1635/1491/products/Ball_State_Cardinals_98e9ff5e-44f0-4b5f-801c-379f35f466fd_320X320.jpg?v=1550659362
Straight Cute Beautiful Attractive Arkansas Razorbacks Leggings,//cdn.shopify.com/s/files/1/1635/1491/products/Arkansas_Razorbacks_d6f25d59-1866-43a2-97cd-7d4abfc53fa2_320X320.jpg?v=1550659359
Straight Cute Beautiful Attractive Arizona Wildcats Leggings,//cdn.shopify.com/s/files/1/1635/1491/products/Arizona_Wildcats_0483a131-30d7-422e-9d95-39b4ac62e060_320X320.jpg?v=1550659354
Straight Cute Beautiful Attractive Arizona State Sun Devils Leggings,//cdn.shopify.com/s/files/1/1635/1491/products/Arizona_State_Sun_Devils_c692e5fc-f2a9-407d-8c9b-c0592d8a074b_320X320.jpg?v=1550659352
Straight Cute Beautiful Attractive Alabama Crimson Tide Leggings,//cdn.shopify.com/s/files/1/1635/1491/products/Alabama_Crimson_Tide_c91956fb-117d-455f-80ea-561d27f81df1_320X320.jpg?v=1550659349
Straight Cute Beautiful Attractive Washington Nationals Leggings,//cdn.shopify.com/s/files/1/1635/1491/products/Washington_Nationals_6a435fe7-fdef-446a-87a3-053b59629284_320X320.jpg?v=1550656541
Straight Cute Beautiful Attractive Texas Rangers Leggings,//cdn.shopify.com/s/files/1/1635/1491/products/Texas_Rangers_9a502e91-5b98-46d8-98cd-177197c72c2c_320X320.jpg?v=1550656534
Straight Cute Beautiful Attractive Tampa Bay Rays Leggings,//cdn.shopify.com/s/files/1/1635/1491/products/Tampa_Bay_Rays_15b34ced-57ff-4540-9915-131891fd44f1_320X320.jpg?v=1550656531
Straight Cute Beautiful Attractive St. Louis Cardinals Leggings,//cdn.shopify.com/s/files/1/1635/1491/products/St_Louis_Cardinals_71a0f36d-db74-4d80-8172-c2725e50c738_320X320.jpg?v=1550656527
Straight Cute Beautiful Attractive Seattle Mariners Leggings,//cdn.shopify.com/s/files/1/1635/1491/products/Seattle_Mariners_6b14b962-fa71-4c88-86fd-18435d8e1555_320X320.jpg?v=1550656523
Straight Cute Beautiful Attractive San Francisco Giants Leggings,//cdn.shopify.com/s/files/1/1635/1491/products/San_Francisco_Giants_1322572b-ad56-4f20-b17b-eb4b5729508f_320X320.jpg?v=1550656519
Straight Cute Beautiful Attractive San Diego Padres Leggings,//cdn.shopify.com/s/files/1/1635/1491/products/San_Diego_Padres_414e980f-7be1-4344-aa43-3fde27cbbffa_320X320.jpg?v=1550656516
Straight Cute Beautiful Attractive Pittsburgh Pirates Leggings,//cdn.shopify.com/s/files/1/1635/1491/products/Pittsburgh_Pirates_2299b888-ab6f-4934-a268-2826b1ef7d0e_320X320.jpg?v=1550656513
Straight Cute Beautiful Attractive Philadelphia Phillies Leggings,//cdn.shopify.com/s/files/1/1635/1491/products/Philadelphia_Phillies_8144b4e7-79a9-47fa-9190-d8021b3f1061_320X320.jpg?v=1550656510
