name,image
Dizzy Motion Zig Zag Chicago Blackhawks Leggings,//cdn.shopify.com/s/files/1/1635/1491/products/Carolina_Hurricanes_198b9f5e-cda1-4bf1-acb0-b13c53680cfc_320X320.jpg?v=1553833907
Dizzy Motion Zig Zag Carolina Hurricanes Leggings,//cdn.shopify.com/s/files/1/1635/1491/products/Chicago_Blackhawks_56af7e18-049b-4937-bdb0-6284c62dda7f_320X320.jpg?v=1553833906
Dizzy Motion Zig Zag Boston Bruins Leggings,//cdn.shopify.com/s/files/1/1635/1491/products/Boston_Bruins_5060bb3a-31d3-475c-9f01-6606349301a5_320X320.jpg?v=1553833904
Dizzy Motion Zig Zag Buffalo Sabres Leggings,//cdn.shopify.com/s/files/1/1635/1491/products/Buffalo_Sabres_9c11ed3b-170f-433f-9824-5ea676717901_320X320.jpg?v=1553833903
Dizzy Motion Zig Zag Anaheim Ducks Leggings,//cdn.shopify.com/s/files/1/1635/1491/products/Anaheim_Ducks_adef4d38-3daf-4080-b55b-8a395d283115_320X320.jpg?v=1553833902
Dizzy Motion Zig Zag Tennessee Titans Leggings,//cdn.shopify.com/s/files/1/1635/1491/products/Tennessee_Titans_a2b871ad-498c-4390-832a-f9b6952ec782_320X320.jpg?v=1553833901
Dizzy Motion Zig Zag Washington Redskins Leggings,//cdn.shopify.com/s/files/1/1635/1491/products/Washington_Redskins_46b6439b-4ec1-47e4-b8f0-e7f31b93ac9d_320X320.jpg?v=1553833900
Dizzy Motion Zig Zag Tampa Bay Buccaneers Leggings,//cdn.shopify.com/s/files/1/1635/1491/products/Tampa_Bay_Buccaneers_ba296317-c581-4c3b-8b73-f14050bb8bf1_320X320.jpg?v=1553833898
Dizzy Motion Zig Zag Seattle Seahawks Leggings,//cdn.shopify.com/s/files/1/1635/1491/products/Seattle_Seahawks_74c48868-7ee0-43d9-ab77-4aa2bdaaa577_320X320.jpg?v=1553833897
Dizzy Motion Zig Zag San Francisco 49ers Leggings,//cdn.shopify.com/s/files/1/1635/1491/products/San_Francisco_49ers_4c32c839-cd7f-401d-a032-85d734332417_320X320.jpg?v=1553833896
Dizzy Motion Zig Zag Philadelphia Eagles Leggings,//cdn.shopify.com/s/files/1/1635/1491/products/Philadelphia_Eagles_60df9253-8db2-4fb9-84b7-b95cad6404e2_320X320.jpg?v=1553833895
Dizzy Motion Zig Zag Pittsburgh Steelers Leggings,//cdn.shopify.com/s/files/1/1635/1491/products/Pittsburgh_Steelers_82432d19-3a5e-4671-bdfc-54a70802b9c1_320X320.jpg?v=1553833893
Dizzy Motion Zig Zag Oakland Raiders Leggings,//cdn.shopify.com/s/files/1/1635/1491/products/Oakland_Raiders_49d35c5e-c5a8-4f3c-ac5e-fdc23b4247aa_320X320.jpg?v=1553833892
Dizzy Motion Zig Zag New York Jets Leggings,//cdn.shopify.com/s/files/1/1635/1491/products/New_York_Jets_8930e1a2-1b7b-41b9-bdc4-0a448c6b3c0d_320X320.jpg?v=1553833891
Dizzy Motion Zig Zag New York Giants Leggings,//cdn.shopify.com/s/files/1/1635/1491/products/New_York_Giants_7aa512b6-2264-4f57-ab3e-613e7942fa5f_320X320.jpg?v=1553833889
Dizzy Motion Zig Zag New Orleans Saints Leggings,//cdn.shopify.com/s/files/1/1635/1491/products/New_Orleans_Saints_d717057a-e542-4e33-a150-4fb1349639ff_320X320.jpg?v=1553833888
Dizzy Motion Zig Zag Miami Dolphins Leggings,//cdn.shopify.com/s/files/1/1635/1491/products/Miami_Dolphins_bb426c0f-4084-459b-8032-7d297997f07f_320X320.jpg?v=1553833884
Dizzy Motion Zig Zag Minnesota Vikings Leggings,//cdn.shopify.com/s/files/1/1635/1491/products/Minnesota_Vikings_3838cc4d-67be-4b61-9839-ce54a41f006c_320X320.jpg?v=1553833883
Dizzy Motion Zig Zag Los Angeles Rams Leggings,//cdn.shopify.com/s/files/1/1635/1491/products/Los_Angeles_Rams_f118b2e4-e7bc-47bb-b84d-715abf7c6c6c_320X320.jpg?v=1553833882
Dizzy Motion Zig Zag Los Angeles Chargers Leggings,//cdn.shopify.com/s/files/1/1635/1491/products/Los_Angeles_Chargers_95ec4c33-991b-4821-aee2-5def0c1a7277_320X320.jpg?v=1553833881
Dizzy Motion Zig Zag Kansas City Chiefs Leggings,//cdn.shopify.com/s/files/1/1635/1491/products/Kansas_City_Chiefs_16601220-9428-478a-a2ff-08551a138b08_320X320.jpg?v=1553833879
Dizzy Motion Zig Zag Jacksonville Jaguars Leggings,//cdn.shopify.com/s/files/1/1635/1491/products/Jacksonville_Jaguars_fa9c75a5-2d39-420c-bac7-7e4726c3a989_320X320.jpg?v=1553833878
Dizzy Motion Zig Zag Indianapolis Colts Leggings,//cdn.shopify.com/s/files/1/1635/1491/products/Indianapolis_Colts_b369f099-3d78-490e-bde8-c81f495e4e48_320X320.jpg?v=1553833877
Dizzy Motion Zig Zag Houston Texans Leggings,//cdn.shopify.com/s/files/1/1635/1491/products/Houston_Texans_6c7af590-4103-483c-aba2-23650e718837_320X320.jpg?v=1553833876
Dizzy Motion Zig Zag Green Bay Packers Leggings,//cdn.shopify.com/s/files/1/1635/1491/products/Green_Bay_Packers_ffd05673-d0b8-421b-b485-7aed32b5f6e5_320X320.jpg?v=1553833874
Dizzy Motion Zig Zag Detroit Lions Leggings,//cdn.shopify.com/s/files/1/1635/1491/products/Detroit_Lions_7da9c254-2f5e-4bb1-bc29-12972e5674bd_320X320.jpg?v=1553833873
Dizzy Motion Zig Zag Denver Broncos Leggings,//cdn.shopify.com/s/files/1/1635/1491/products/Denver_Broncos_5a384e97-e5af-4fe4-b6e7-c004116f63cd_320X320.jpg?v=1553833871
Dizzy Motion Zig Zag Cleveland Browns Leggings,//cdn.shopify.com/s/files/1/1635/1491/products/Cleveland_Browns_4a291722-4f9a-4c30-be08-1c391ff50bce_320X320.jpg?v=1553833870
Dizzy Motion Zig Zag Cincinnati Bengals Leggings,//cdn.shopify.com/s/files/1/1635/1491/products/Cincinnati_Bengals_00109c5f-c719-4e3c-894e-a9e0b5c5f4da_320X320.jpg?v=1553833869
Dizzy Motion Zig Zag Chicago Bears Leggings,//cdn.shopify.com/s/files/1/1635/1491/products/Chicago_Bears_19fbdd3f-63a8-461b-b934-2b8f9fe8919b_320X320.jpg?v=1553833867
Dizzy Motion Zig Zag Carolina Panthers Leggings,//cdn.shopify.com/s/files/1/1635/1491/products/Carolina_Panthers_d21437d0-6853-4452-addc-a6aef90dee99_320X320.jpg?v=1553833866
Dizzy Motion Zig Zag Buffalo Bills Leggings,//cdn.shopify.com/s/files/1/1635/1491/products/Buffalo_Bills_1a160a74-31b9-4ac9-8ecb-3bbdb31754fb_320X320.jpg?v=1553833865
Dizzy Motion Zig Zag Baltimore Ravens Leggings,//cdn.shopify.com/s/files/1/1635/1491/products/Baltimore_Ravens_80899b68-3107-4375-87a3-7da64b47b409_320X320.jpg?v=1553833863
Dizzy Motion Zig Zag Atlanta Falcons Leggings,//cdn.shopify.com/s/files/1/1635/1491/products/Atlanta_Falcons_f7c47491-a638-4bec-97d0-183655b3e416_320X320.jpg?v=1553833862
Dizzy Motion Zig Zag Arizona Cardinals Leggings,//cdn.shopify.com/s/files/1/1635/1491/products/Arizona_Cardinals_2a5c2c10-1ca8-4d65-b4bc-4569a67d04f2_320X320.jpg?v=1553833860
Dizzy Motion Zig Zag UCLA Bruins Leggings,//cdn.shopify.com/s/files/1/1635/1491/products/UCLA_Bruins_1ee976fe-5f1b-449f-a915-9de99c9bc837_320X320.jpg?v=1553833859
Dizzy Motion Zig Zag Texas Longhorns Leggings,//cdn.shopify.com/s/files/1/1635/1491/products/Texas_Longhorns_872fd46e-d4e2-48f7-a95f-43fe24134779_320X320.jpg?v=1553833858
Dizzy Motion Zig Zag Tennessee Volunteers Leggings,//cdn.shopify.com/s/files/1/1635/1491/products/Tennessee_Volunteers_72f65d9b-078a-4d26-bda8-d5f3bd856d7d_320X320.jpg?v=1553833856
Dizzy Motion Zig Zag Ohio State Buckeyes Leggings,//cdn.shopify.com/s/files/1/1635/1491/products/Ohio_State_Buckeyes_80202cc8-e836-4989-bb4c-384ccf2ee93f_320X320.jpg?v=1553833855
Dizzy Motion Zig Zag Oklahoma Sooners Leggings,//cdn.shopify.com/s/files/1/1635/1491/products/Oklahoma_Sooners_899c10a1-db13-47d4-8f15-0d326f5c2669_320X320.jpg?v=1553833854
Dizzy Motion Zig Zag LSU Tigers Leggings,//cdn.shopify.com/s/files/1/1635/1491/products/LSU_Tigers_006b08f0-5b8b-4a07-a184-095e5d7cfb8f_320X320.jpg?v=1553833851
Dizzy Motion Zig Zag Notre Dame Fighting Irish Leggings,//cdn.shopify.com/s/files/1/1635/1491/products/Notre_Dame_Fighting_Irish_7c381bc1-a3fe-4bd9-8e06-26f82bfc9739_320X320.jpg?v=1553833850
Dizzy Motion Zig Zag Florida State Seminoles Leggings,//cdn.shopify.com/s/files/1/1635/1491/products/Florida_State_Seminoles_9a52a678-c137-4ce8-929a-8efb2815b14f_320X320.jpg?v=1553833849
Dizzy Motion Zig Zag Arizona Wildcats Leggings,//cdn.shopify.com/s/files/1/1635/1491/products/Arizona_Wildcats_d7fa84c7-288a-4b86-a78e-700cfa4b4280_320X320.jpg?v=1553833847
Dizzy Motion Zig Zag Arkansas Razorbacks Leggings,//cdn.shopify.com/s/files/1/1635/1491/products/Arkansas_Razorbacks_e441f614-0cec-4e63-9ac0-c4628a5306b0_320X320.jpg?v=1553833846
Dizzy Motion Zig Zag Alabama Crimson Tide Leggings,//cdn.shopify.com/s/files/1/1635/1491/products/Alabama_Crimson_Tide_4807d919-8ede-43f4-9882-7c60f5c9e1a4_320X320.jpg?v=1553833845
Dizzy Motion Zig Zag Texas Rangers Leggings,//cdn.shopify.com/s/files/1/1635/1491/products/Texas_Rangers_6574efaf-3181-4c0f-9ced-f48c294bcd09_320X320.jpg?v=1553833843
Dizzy Motion Zig Zag San Francisco Giants Leggings,//cdn.shopify.com/s/files/1/1635/1491/products/San_Francisco_Giants_b964e3ea-32e3-45f3-b560-ffa949a2ad62_320X320.jpg?v=1553833842
Dizzy Motion Zig Zag St. Louis Cardinals Leggings,//cdn.shopify.com/s/files/1/1635/1491/products/St._Louis_Cardinals_bc55d0a4-81d1-4a85-95cb-dadf2f37a440_320X320.jpg?v=1553833841
Dizzy Motion Zig Zag Pittsburgh Pirates Leggings,//cdn.shopify.com/s/files/1/1635/1491/products/Pittsburgh_Pirates_a1381b8e-0b1b-40b3-be62-11441fbd7fba_320X320.jpg?v=1553833840
Dizzy Motion Zig Zag New York Yankees Leggings,//cdn.shopify.com/s/files/1/1635/1491/products/New_York_Yankees_e359ca44-2f10-46d9-b444-44ca19969fa6_320X320.jpg?v=1553833839
Dizzy Motion Zig Zag Philadelphia Phillies Leggings,//cdn.shopify.com/s/files/1/1635/1491/products/Philadelphia_Phillies_68bd2232-f7ed-46f8-903d-55073ed63580_320X320.jpg?v=1553833837
Dizzy Motion Zig Zag New York Mets Leggings,//cdn.shopify.com/s/files/1/1635/1491/products/New_York_Mets_9d7b203e-afa2-466a-82b4-c5faaea782c7_320X320.jpg?v=1553833836
Dizzy Motion Zig Zag Minnesota Twins Leggings,//cdn.shopify.com/s/files/1/1635/1491/products/Minnesota_Twins_ffec51ee-9b07-4e34-a88c-25789e716141_320X320.jpg?v=1553833835
Dizzy Motion Zig Zag Milwaukee Brewers Leggings,//cdn.shopify.com/s/files/1/1635/1491/products/Milwaukee_Brewers_38fbd72d-bfbd-48a2-9b4d-6fdad499e701_320X320.jpg?v=1553833833
Dizzy Motion Zig Zag Los Angeles Dodgers Leggings,//cdn.shopify.com/s/files/1/1635/1491/products/Los_Angeles_Dodgers_d94174b8-488e-4dc9-9e86-e626b340c959_320X320.jpg?v=1553833832
Dizzy Motion Zig Zag Houston Astros Leggings,//cdn.shopify.com/s/files/1/1635/1491/products/Houston_Astros_a945d947-0e80-4c05-af83-fcc1939302f0_320X320.jpg?v=1553833831
Dizzy Motion Zig Zag Detroit Tigers Leggings,//cdn.shopify.com/s/files/1/1635/1491/products/Detroit_Tigers_52e7b990-3ff7-4fd5-ba94-f82b0f77f393_320X320.jpg?v=1553833830
Dizzy Motion Zig Zag Cleveland Indians Leggings,//cdn.shopify.com/s/files/1/1635/1491/products/Cleveland_Indians_c8cd6aa5-3e1d-48ca-a1cb-46d761dd285d_320X320.jpg?v=1553833829
Dizzy Motion Zig Zag Cincinnati Reds Leggings,//cdn.shopify.com/s/files/1/1635/1491/products/Cincinnati_Reds_a15fb276-2ea5-4f75-9e2e-ec06c0cf808f_320X320.jpg?v=1553833827
Dizzy Motion Zig Zag Chicago White Sox Leggings,//cdn.shopify.com/s/files/1/1635/1491/products/Chicago_White_Sox_70109411-e23b-434b-b101-6e5e14e8d60b_320X320.jpg?v=1553833826
Dizzy Motion Zig Zag Chicago Cubs Leggings,//cdn.shopify.com/s/files/1/1635/1491/products/Chicago_Cubs_c064c871-543c-4718-a3e5-1e03156a29f0_320X320.jpg?v=1553833825
Dizzy Motion Zig Zag Baltimore Orioles Leggings,//cdn.shopify.com/s/files/1/1635/1491/products/Baltimore_Orioles_f7d89304-b569-420a-a994-0bdcee744b5c_320X320.jpg?v=1553833824
Dizzy Motion Zig Zag Atlanta Braves Leggings,//cdn.shopify.com/s/files/1/1635/1491/products/Atlanta_Brave_320X320.jpg?v=1553833823
Unbelievable Sign Marvelous Awesome Washington Capitals Leggings,//cdn.shopify.com/s/files/1/1635/1491/products/d327928d-384f-49b5-aa70-f6d30b096786_320X320.jpg?v=1551320917
Unbelievable Sign Marvelous Awesome Vegas Golden Knights Leggings,//cdn.shopify.com/s/files/1/1635/1491/products/3ad4f716-86a2-4bf2-9627-f1cdadb2634c_320X320.jpg?v=1551320893
Unbelievable Sign Marvelous Awesome Tampa Bay Lightning Leggings,//cdn.shopify.com/s/files/1/1635/1491/products/cfecc4f3-b269-4a24-95fc-0757f7076104_320X320.jpg?v=1551320864
Unbelievable Sign Marvelous Awesome St. Louis Blues Leggings,//cdn.shopify.com/s/files/1/1635/1491/products/31a08c38-33ed-4986-88de-4d8e7c979044_320X320.jpg?v=1551320842
Unbelievable Sign Marvelous Awesome San Jose Sharks Leggings,//cdn.shopify.com/s/files/1/1635/1491/products/83db6ce5-0a3b-4177-baa1-23417970a355_320X320.jpg?v=1551320814
Unbelievable Sign Marvelous Awesome Pittsburgh Penguins Leggings,//cdn.shopify.com/s/files/1/1635/1491/products/24fc872a-d3c3-465b-b3b7-ec0f969f93ba_320X320.jpg?v=1551320791
Unbelievable Sign Marvelous Awesome Philadelphia Flyers Leggings,//cdn.shopify.com/s/files/1/1635/1491/products/387888f6-cbc4-47bf-8a7f-c34437f52d9e_320X320.jpg?v=1551320766
Unbelievable Sign Marvelous Awesome New York Rangers Leggings,//cdn.shopify.com/s/files/1/1635/1491/products/80d5b310-c82e-4ce3-9393-b5e083e9ca5e_320X320.jpg?v=1551320741
Unbelievable Sign Marvelous Awesome New York Islanders Leggings,//cdn.shopify.com/s/files/1/1635/1491/products/4dde8e3d-b6d1-42b3-a3ae-d8be3d2b871a_320X320.jpg?v=1551320719
Unbelievable Sign Marvelous Awesome New Jersey Devils Leggings,//cdn.shopify.com/s/files/1/1635/1491/products/53cc998f-8923-46af-b03b-5040a2fb74cd_320X320.jpg?v=1551320697
Unbelievable Sign Marvelous Awesome Nashville Predators Leggings,//cdn.shopify.com/s/files/1/1635/1491/products/2a9aee4a-9af8-42ed-a40a-6fbfb302591e_320X320.jpg?v=1551320673
Unbelievable Sign Marvelous Awesome Minnesota Wild Leggings,//cdn.shopify.com/s/files/1/1635/1491/products/6669d610-55dc-413f-89d2-cddf8789d002_320X320.jpg?v=1551320651
Unbelievable Sign Marvelous Awesome Detroit Red Wings Leggings,//cdn.shopify.com/s/files/1/1635/1491/products/8faf0531-6b65-4e71-bd05-4111268c9a61_320X320.jpg?v=1551320627
Unbelievable Sign Marvelous Awesome Colorado Avalanche Leggings,//cdn.shopify.com/s/files/1/1635/1491/products/92ee5936-c220-4ba7-a2a2-810890a9cf12_320X320.jpg?v=1551320603
Unbelievable Sign Marvelous Awesome Chicago Blackhawks Leggings,//cdn.shopify.com/s/files/1/1635/1491/products/9af5ec29-f6e2-4123-bc80-9c12dfd381cb_320X320.jpg?v=1551320573
Unbelievable Sign Marvelous Awesome Carolina Hurricanes Leggings,//cdn.shopify.com/s/files/1/1635/1491/products/ef214ed7-c848-46bd-9a3f-4d9f7b8534bc_320X320.jpg?v=1551320548
Unbelievable Sign Marvelous Awesome Buffalo Sabres Leggings,//cdn.shopify.com/s/files/1/1635/1491/products/1c6d3a9b-7f3f-48ed-a15a-7c708fd966bf_320X320.jpg?v=1551320524
Unbelievable Sign Marvelous Awesome Boston Bruins Leggings,//cdn.shopify.com/s/files/1/1635/1491/products/6e12ab3a-87a2-41de-b006-ba9654f67937_320X320.jpg?v=1551320503
Unbelievable Sign Marvelous Awesome Anaheim Ducks Leggings,//cdn.shopify.com/s/files/1/1635/1491/products/ae760046-5108-4ad0-9534-d233a9f1e3e6_320X320.jpg?v=1551320479
Unbelievable Sign Marvelous Awesome Washington Redskins Leggings,//cdn.shopify.com/s/files/1/1635/1491/products/b8c4a2f5-3290-4ba5-b4fa-d405dcc36c0e_320X320.jpg?v=1551319429
Unbelievable Sign Marvelous Awesome Tennessee Titans Leggings,//cdn.shopify.com/s/files/1/1635/1491/products/741b044b-4568-4244-a4b5-722132a6b730_320X320.jpg?v=1551319424
Unbelievable Sign Marvelous Awesome Tampa Bay Buccaneers Leggings,//cdn.shopify.com/s/files/1/1635/1491/products/c2ff144e-1d14-4141-abe2-7136805fe3fd_320X320.jpg?v=1551319091
Unbelievable Sign Marvelous Awesome Seattle Seahawks Leggings,//cdn.shopify.com/s/files/1/1635/1491/products/6fb6e54d-d45e-47a4-a3c1-91f9ccb3b137_320X320.jpg?v=1551319038
Unbelievable Sign Marvelous Awesome San Francisco 49ers Leggings,//cdn.shopify.com/s/files/1/1635/1491/products/f2541f6e-563e-4256-81e1-c1f49704898a_320X320.jpg?v=1551318861
Unbelievable Sign Marvelous Awesome Pittsburgh Steelers Leggings,//cdn.shopify.com/s/files/1/1635/1491/products/6575c0e3-fd96-4bc6-90cd-c136ea9e20b6_320X320.jpg?v=1551318865
Unbelievable Sign Marvelous Awesome Philadelphia Eagles Leggings,//cdn.shopify.com/s/files/1/1635/1491/products/9e4b61fa-eed2-4a00-8be8-93ae5fe4e99c_320X320.jpg?v=1551318729
Unbelievable Sign Marvelous Awesome Oakland Raiders Leggings,//cdn.shopify.com/s/files/1/1635/1491/products/6acb4fd2-2c82-43de-85fb-c919404009ac_320X320.jpg?v=1551318699
Unbelievable Sign Marvelous Awesome New York Jets Leggings,//cdn.shopify.com/s/files/1/1635/1491/products/f9c6e8e4-4a50-407e-9164-139791365283_320X320.jpg?v=1551263965
Unbelievable Sign Marvelous Awesome New York Giants Leggings,//cdn.shopify.com/s/files/1/1635/1491/products/827852e7-09d4-4e31-9a57-7b0dcfb8135c_320X320.jpg?v=1551263906
Unbelievable Sign Marvelous Awesome New Orleans Saints Leggings,//cdn.shopify.com/s/files/1/1635/1491/products/30ff5f7f-c4b6-48e6-ae24-a5372f4bcbd2_320X320.jpg?v=1551263848
Unbelievable Sign Marvelous Awesome New England Patriots Leggings,//cdn.shopify.com/s/files/1/1635/1491/products/dcc07772-babd-4ee9-8ac2-22e1d64f79ae_320X320.jpg?v=1551263820
Unbelievable Sign Marvelous Awesome Minnesota Vikings Leggings,//cdn.shopify.com/s/files/1/1635/1491/products/c0b9e658-86f3-4345-9852-46dac0d3976c_320X320.jpg?v=1551263428
Unbelievable Sign Marvelous Awesome Miami Dolphins Leggings,//cdn.shopify.com/s/files/1/1635/1491/products/ffbaf728-0894-4f82-8251-03b2d302e88f_320X320.jpg?v=1551263349
Unbelievable Sign Marvelous Awesome Los Angeles Rams Leggings,//cdn.shopify.com/s/files/1/1635/1491/products/0d52a6a6-749c-4ed7-aa8a-51efaa4d9aa2_320X320.jpg?v=1551263295
Unbelievable Sign Marvelous Awesome Los Angeles Chargers Leggings,//cdn.shopify.com/s/files/1/1635/1491/products/44764237-c177-47b2-ba25-c08357c23428_320X320.jpg?v=1551263246
Unbelievable Sign Marvelous Awesome Kansas City Chiefs Leggings,//cdn.shopify.com/s/files/1/1635/1491/products/43020f57-69d0-48ca-9259-78940552ea00_320X320.jpg?v=1551263190
Unbelievable Sign Marvelous Awesome Jacksonville Jaguars Leggings,//cdn.shopify.com/s/files/1/1635/1491/products/5ee38ba8-934c-40a0-baef-33ce93e3aa22_320X320.jpg?v=1551263132
Unbelievable Sign Marvelous Awesome Indianapolis Colts Leggings,//cdn.shopify.com/s/files/1/1635/1491/products/9c3b62e9-6d89-4b62-a8b1-d993fee7ba7c_320X320.jpg?v=1551262524
Unbelievable Sign Marvelous Awesome Houston Texans Leggings,//cdn.shopify.com/s/files/1/1635/1491/products/605d7225-d97b-4a61-aa98-babda22f8fc7_320X320.jpg?v=1551262471
Unbelievable Sign Marvelous Awesome Green Bay Packers Leggings,//cdn.shopify.com/s/files/1/1635/1491/products/c1a6d65a-5bc7-4278-bc6a-d8a12ebf529b_320X320.jpg?v=1551262430
Unbelievable Sign Marvelous Awesome Detroit Lions Leggings,//cdn.shopify.com/s/files/1/1635/1491/products/778e0838-e6ca-4387-991f-9d11ddf7da39_320X320.jpg?v=1551262385
Unbelievable Sign Marvelous Awesome Denver Broncos Leggings,//cdn.shopify.com/s/files/1/1635/1491/products/96143171-6e67-4a39-a78e-278517124414_320X320.jpg?v=1551262339
Unbelievable Sign Marvelous Awesome Cleveland Browns Leggings,//cdn.shopify.com/s/files/1/1635/1491/products/8169c688-a276-46e4-831f-63857a5e998e_320X320.jpg?v=1551262293
Unbelievable Sign Marvelous Awesome Cincinnati Bengals Leggings,//cdn.shopify.com/s/files/1/1635/1491/products/c7131122-a585-4cae-a09e-ddcf85544d77_320X320.jpg?v=1551262254
Unbelievable Sign Marvelous Awesome Chicago Bears Leggings,//cdn.shopify.com/s/files/1/1635/1491/products/140da3af-823a-4f8e-b5f9-77bdefb7b4fc_320X320.jpg?v=1551262224
Unbelievable Sign Marvelous Awesome Carolina Panthers Leggings,//cdn.shopify.com/s/files/1/1635/1491/products/6dae3716-77a7-491d-9f79-f0d533132335_320X320.jpg?v=1551262186
Unbelievable Sign Marvelous Awesome Buffalo Bills Leggings,//cdn.shopify.com/s/files/1/1635/1491/products/d61f0695-8d1f-476f-865d-4b30ea45c91e_320X320.jpg?v=1551261858
Unbelievable Sign Marvelous Awesome Baltimore Ravens Leggings,//cdn.shopify.com/s/files/1/1635/1491/products/346061eb-d340-4239-810e-3ad5cc749350_320X320.jpg?v=1551261854
Unbelievable Sign Marvelous Awesome Atlanta Falcons Leggings,//cdn.shopify.com/s/files/1/1635/1491/products/6beb87ec-d3aa-4f4e-a832-ee327ebdaae0_320X320.jpg?v=1551261817
Unbelievable Sign Marvelous Awesome Arizona Cardinals Leggings,//cdn.shopify.com/s/files/1/1635/1491/products/b8ccb9ed-44e8-4d51-a6de-9aa9c0a786bd_320X320.jpg?v=1551261785
Unbelievable Sign Marvelous Awesome UCLA Bruins Leggings,//cdn.shopify.com/s/files/1/1635/1491/products/e9cf8447-5b14-4b33-ac07-bc4a3fdf8935_320X320.jpg?v=1551260934
Unbelievable Sign Marvelous Awesome Texas Longhorns Leggings,//cdn.shopify.com/s/files/1/1635/1491/products/9166c993-8f93-4922-859c-a032f20a28d8_320X320.jpg?v=1551260894
Unbelievable Sign Marvelous Awesome Tennessee Volunteers Leggings,//cdn.shopify.com/s/files/1/1635/1491/products/7d38f110-8e2e-46e4-a63a-7cae5fd0de8e_320X320.jpg?v=1551260817
Unbelievable Sign Marvelous Awesome Oklahoma Sooners Leggings,//cdn.shopify.com/s/files/1/1635/1491/products/e56110c9-5b6b-4e99-a6a1-3d5fbe88a2d1_320X320.jpg?v=1551260810
Unbelievable Sign Marvelous Awesome Ohio State Buckeyes Leggings,//cdn.shopify.com/s/files/1/1635/1491/products/33a4f7ab-cd83-4f52-9ba7-a96c28a7ae92_320X320.jpg?v=1551260754
Unbelievable Sign Marvelous Awesome Notre Dame Fighting Irish Leggings,//cdn.shopify.com/s/files/1/1635/1491/products/9a94e54a-b62a-43e3-b39c-60ebe629b6e5_320X320.jpg?v=1551260757
Unbelievable Sign Marvelous Awesome LSU Tigers Leggings,//cdn.shopify.com/s/files/1/1635/1491/products/53043790-83b1-4619-b4b9-a4ddd6c8b96d_320X320.jpg?v=1551260688
Unbelievable Sign Marvelous Awesome Florida State Seminoles Leggings,//cdn.shopify.com/s/files/1/1635/1491/products/4f417011-558f-4a0d-a84d-8cb5c09324bf_320X320.jpg?v=1551260642
Unbelievable Sign Marvelous Awesome Arkansas Razorbacks Leggings,//cdn.shopify.com/s/files/1/1635/1491/products/88985bee-435a-467b-9ab8-a3664ad45117_320X320.jpg?v=1551260611
Unbelievable Sign Marvelous Awesome Arizona Wildcats Leggings,//cdn.shopify.com/s/files/1/1635/1491/products/0614cc4a-b6cc-4464-aab1-8e7e93e65793_320X320.jpg?v=1551260583
Unbelievable Sign Marvelous Awesome Alabama Crimson Tide Leggings,//cdn.shopify.com/s/files/1/1635/1491/products/2c9a1a62-b2bc-4a7f-8565-23ad485a81dc_320X320.jpg?v=1551260586
Unbelievable Sign Marvelous Awesome Texas Rangers Leggings,//cdn.shopify.com/s/files/1/1635/1491/products/b02bc77a-302a-432c-b8ca-2624e51d3681_320X320.jpg?v=1551259077
Unbelievable Sign Marvelous Awesome St. Louis Cardinals Leggings,//cdn.shopify.com/s/files/1/1635/1491/products/2a08c921-b98c-40a8-afcd-56ad4b75567b_320X320.jpg?v=1551259049
Unbelievable Sign Marvelous Awesome San Francisco Giants Leggings,//cdn.shopify.com/s/files/1/1635/1491/products/0d34571f-75c1-44ab-a86d-10c53fabcb27_320X320.jpg?v=1551259023
Unbelievable Sign Marvelous Awesome Pittsburgh Pirates Leggings,//cdn.shopify.com/s/files/1/1635/1491/products/afdfe527-1d95-4ed0-b413-a14ac6f3980c_320X320.jpg?v=1551259000
Unbelievable Sign Marvelous Awesome Philadelphia Phillies Leggings,//cdn.shopify.com/s/files/1/1635/1491/products/f79ed257-994a-4fe0-aaff-e10f8d8adfce_320X320.jpg?v=1551258975
Unbelievable Sign Marvelous Awesome New York Yankees Leggings,//cdn.shopify.com/s/files/1/1635/1491/products/33a72878-123e-48f5-a124-397d48f5fe45_320X320.jpg?v=1551258955
Unbelievable Sign Marvelous Awesome New York Mets Leggings,//cdn.shopify.com/s/files/1/1635/1491/products/786d3154-c3e5-4cc6-bbe3-ca9a4d1b5eb3_320X320.jpg?v=1551258951
Unbelievable Sign Marvelous Awesome Minnesota Twins Leggings,//cdn.shopify.com/s/files/1/1635/1491/products/5aacd46b-664a-456f-b115-e2c40a7bd3b9_320X320.jpg?v=1551258903
Unbelievable Sign Marvelous Awesome Milwaukee Brewers Leggings,//cdn.shopify.com/s/files/1/1635/1491/products/2ce80fba-e0f0-4c5f-ad4d-619b4eb6590e_320X320.jpg?v=1551258876
Unbelievable Sign Marvelous Awesome Los Angeles Dodgers Leggings,//cdn.shopify.com/s/files/1/1635/1491/products/1178be4a-5f53-49b7-b5b3-15b70d5c1dc3_320X320.jpg?v=1551258858
Unbelievable Sign Marvelous Awesome Houston Astros Leggings,//cdn.shopify.com/s/files/1/1635/1491/products/53f975ea-fec9-41fd-8d79-fd99d3351070_320X320.jpg?v=1551258832
Unbelievable Sign Marvelous Awesome Detroit Tigers Leggings,//cdn.shopify.com/s/files/1/1635/1491/products/bd772faf-7a6c-496c-8430-1e47b27546f8_320X320.jpg?v=1551258784
Unbelievable Sign Marvelous Awesome Cleveland Indians Leggings,//cdn.shopify.com/s/files/1/1635/1491/products/8bfbc9d9-da09-4fda-8ecf-684a1f3f8811_320X320.jpg?v=1551258809
Unbelievable Sign Marvelous Awesome Cincinnati Reds Leggings,//cdn.shopify.com/s/files/1/1635/1491/products/523b36da-21bf-4a9c-a4bb-a69783aba7e3_320X320.jpg?v=1551258789
Unbelievable Sign Marvelous Awesome Chicago White Sox Leggings,//cdn.shopify.com/s/files/1/1635/1491/products/96b33c1e-511a-453b-a7d2-ec136209c5aa_320X320.jpg?v=1551258731
Unbelievable Sign Marvelous Awesome Chicago Cubs Leggings,//cdn.shopify.com/s/files/1/1635/1491/products/66fadaba-c72c-4f23-a42b-c81182dd0bf2_320X320.jpg?v=1551258721
Unbelievable Sign Marvelous Awesome Baltimore Orioles Leggings,//cdn.shopify.com/s/files/1/1635/1491/products/64e24cdb-a76e-4fc8-922c-67c265ef6707_320X320.jpg?v=1551258646
Unbelievable Sign Marvelous Awesome Atlanta Braves Leggings,//cdn.shopify.com/s/files/1/1635/1491/products/a6ee0f7b-c5df-442c-b9ab-d7f3da68d731_320X320.jpg?v=1551258186
Curly Line Charming Daily Fashion San Jose Sharks Leggings,//cdn.shopify.com/s/files/1/1635/1491/products/a1d3101c-cd3b-4751-99e7-702376564f59_320X320.jpg?v=1551173813
Curly Line Charming Daily Fashion St. Louis Blues Leggings,//cdn.shopify.com/s/files/1/1635/1491/products/ddfb3eef-f542-4b3f-a26b-cf43e614b7a2_320X320.jpg?v=1551159135
Curly Line Charming Daily Fashion Washington Capitals Leggings,//cdn.shopify.com/s/files/1/1635/1491/products/56baeeaa-7d8a-400c-9619-88b91d90a846_320X320.jpg?v=1551159236
Curly Line Charming Daily Fashion Vegas Golden Knights Leggings,//cdn.shopify.com/s/files/1/1635/1491/products/4b15bed7-dc94-46ad-bf90-7d86450b58c2_320X320.jpg?v=1551159218
Curly Line Charming Daily Fashion Tampa Bay Lightning Leggings,//cdn.shopify.com/s/files/1/1635/1491/products/f19df940-c25b-4fad-87fb-6a08cf34d852_320X320.jpg?v=1551159195
Curly Line Charming Daily Fashion Pittsburgh Penguins Leggings,//cdn.shopify.com/s/files/1/1635/1491/products/a87d1b1b-201a-473a-bdc3-3f7737819255_320X320.jpg?v=1551159095
Curly Line Charming Daily Fashion Philadelphia Flyers Leggings,//cdn.shopify.com/s/files/1/1635/1491/products/bcb70cb0-807b-45c0-b04b-aef2cfd89117_320X320.jpg?v=1551159020
